price,room_type,accommodates,bedrooms,beds,review_scores_rating,address_japanese,shiku,townpart,detailpart
5000000.0,Private room,2,1.0,1.0,4.27, 港区芝大門1丁目2-9 ポートビル, 港区, 港区芝大門1丁目,2-9 ポートビル
5000000.0,Private room,2,1.0,1.0,4.78, 港区浜松町1丁目27 大門駅, 港区, 港区浜松町1丁目,27 大門駅
5000000.0,Private room,2,1.0,1.0,4.85, 港区浜松町1丁目11-7, 港区, 港区浜松町1丁目,11-7
5000000.0,Private room,2,1.0,1.0,4.94, 港区浜松町1丁目23-2, 港区, 港区浜松町1丁目,23-2
5000000.0,Private room,2,,1.0,4.74, 港区芝大門1丁目−4−４ ノア芝大門110, 港区, 港区芝大門1丁目,−4−４ ノア芝大門110
5000000.0,Private room,2,,1.0,4.87, 墨田区石原4丁目14-9, 墨田区, 墨田区石原4丁目,14-9
1882300.0,Entire home apt,6,2.0,4.0,4.88, 墨田区石原4丁目13-9, 墨田区, 墨田区石原4丁目,13-9
1924100.0,Entire home apt,6,2.0,3.0,4.65, 世田谷区深沢2丁目9-3, 世田谷区, 世田谷区深沢2丁目,9-3
1200000.0,Entire home apt,3,1.0,2.0,5.0, 新宿区若松町26-10, 新宿区,, 新宿区若松町26-10
844100.0,Entire home apt,3,1.0,1.0,, 墨田区八広2丁目41-7, 墨田区, 墨田区八広2丁目,41-7
997700.0,Private room,2,,1.0,4.5,品川区南品川4丁目−1−14 ラビール南品川,品川区,品川区南品川4丁目,−1−14 ラビール南品川
2357100.0,Entire home apt,6,1.0,2.0,4.59, 墨田区東向島6丁目10-12, 墨田区, 墨田区東向島6丁目,10-12
3106300.0,Entire home apt,12,4.0,4.0,4.84, 江戸川区平井2丁目9-11, 江戸川区, 江戸川区平井2丁目,9-11
967100.0,Entire home apt,3,1.0,2.0,4.47,練馬区北町１丁目−８−１ コスモピュアセルフ練馬ＳＳ,練馬区,練馬区北町１丁目,−８−１ コスモピュアセルフ練馬ＳＳ
912900.0,Entire home apt,2,1.0,2.0,4.83,新宿区高田馬場3丁目−25−２７ ハイムプリメール,新宿区,新宿区高田馬場3丁目,−25−２７ ハイムプリメール
3017100.0,Entire home apt,8,3.0,3.0,4.29, 大田区西糀谷4丁目−4 メゾン堀, 大田区, 大田区西糀谷4丁目,−4 メゾン堀
2800000.0,Entire home apt,6,3.0,4.0,4.86, 板橋区板橋1丁目−8−４ コトブキ第一ビル, 板橋区, 板橋区板橋1丁目,−8−４ コトブキ第一ビル
1495700.0,Entire home apt,3,1.0,1.0,4.43, 新宿区高田馬場3丁目15-5, 新宿区, 新宿区高田馬場3丁目,15-5
750000.0,Entire home apt,2,1.0,1.0,4.5,新宿区大久保2丁目−18 小駒レジデンス,新宿区,新宿区大久保2丁目,−18 小駒レジデンス
1965700.0,Entire home apt,3,1.0,2.0,4.85, 千代田区神田錦町1丁目2-1, 千代田区, 千代田区神田錦町1丁目,2-1
524600.0,Shared room,1,,1.0,4.49, 江戸川区平井2丁目9-14, 江戸川区, 江戸川区平井2丁目,9-14
1395900.0,Entire home apt,3,1.0,3.0,4.71,新宿区大久保２丁目−15−２３ バローネ新宿,新宿区,新宿区大久保２丁目,−15−２３ バローネ新宿
1842900.0,Entire home apt,3,1.0,2.0,4.79, 千代田区神田錦町1丁目2-1, 千代田区, 千代田区神田錦町1丁目,2-1
622200.0,Shared room,1,,1.0,4.79, 新宿区歌舞伎町2丁目9-15 ダイヤモンドパレス, 新宿区, 新宿区歌舞伎町2丁目,9-15 ダイヤモンドパレス
2785700.0,Entire home apt,5,2.0,3.0,4.71, 文京区水道2丁目−1−３ グランスイート文京小桜507号 フィットネスクラブ・ヘルシア内, 文京区, 文京区水道2丁目,−1−３ グランスイート文京小桜507号 フィットネスクラブ・ヘルシア内
2971400.0,Private room,4,,1.0,4.75, 中野区中央4丁目61-2, 中野区, 中野区中央4丁目,61-2
928600.0,Private room,2,1.0,1.0,4.82, 新宿区高田馬場3丁目−11−６ ブランドール11, 新宿区, 新宿区高田馬場3丁目,−11−６ ブランドール11
900000.0,Entire home apt,3,1.0,1.0,4.74, 新宿区高田馬場3丁目−11−６ ブランドール11, 新宿区, 新宿区高田馬場3丁目,−11−６ ブランドール11
950000.0,Entire home apt,3,1.0,1.0,4.85, 墨田区千歳3丁目−17−２０ 飯塚ビル1階, 墨田区, 墨田区千歳3丁目,−17−２０ 飯塚ビル1階
744400.0,Entire home apt,2,1.0,1.0,5.0, 墨田区緑2丁目1-3, 墨田区, 墨田区緑2丁目,1-3
939500.0,Entire home apt,2,1.0,1.0,4.74, 墨田区緑1丁目−12 朝鳥ビル１階, 墨田区, 墨田区緑1丁目,−12 朝鳥ビル１階
903200.0,Entire home apt,2,1.0,1.0,4.92, 墨田区押上1丁目48-7, 墨田区, 墨田区押上1丁目,48-7
500000.0,Private room,2,,1.0,4.48, 小金井市梶野町4丁目−13 さくらコーポ, 小金井市, 小金井市梶野町4丁目,−13 さくらコーポ
1800000.0,Private room,2,,1.0,5.0, 新宿区大久保2丁目31-12, 新宿区, 新宿区大久保2丁目,31-12
3071400.0,Entire home apt,3,1.0,3.0,4.87, 渋谷区道玄坂2丁目9-7, 渋谷区, 渋谷区道玄坂2丁目,9-7
3230000.0,Entire home apt,2,1.0,2.0,4.83, 台東区入谷 2 丁目 39-5, 台東区, 台東区入谷 2 丁目, 39-5
832000.0,Private room,2,1.0,1.0,4.79, 渋谷区恵比寿南2丁目−27−10 カーサ水谷２, 渋谷区, 渋谷区恵比寿南2丁目,−27−10 カーサ水谷２
817200.0,Entire home apt,2,1.0,1.0,4.43, 渋谷区恵比寿南2丁目31-8, 渋谷区, 渋谷区恵比寿南2丁目,31-8
817200.0,Entire home apt,2,1.0,1.0,4.62, 墨田区八広6丁目9-19, 墨田区, 墨田区八広6丁目,9-19
1335700.0,Entire home apt,5,2.0,4.0,4.74, 杉並区和泉2丁目5-7, 杉並区, 杉並区和泉2丁目,5-7
705500.0,Entire home apt,2,1.0,1.0,4.83,品川区東中延1丁目−10−２ ガーデンリックス荏原中延,品川区,品川区東中延1丁目,−10−２ ガーデンリックス荏原中延
2591400.0,Entire home apt,10,3.0,10.0,4.93, 港区南麻布1丁目−5−５ 青木葉マンション, 港区, 港区南麻布1丁目,−5−５ 青木葉マンション
1800000.0,Entire home apt,6,1.0,4.0,, 江戸川区平井2丁目11-3, 江戸川区, 江戸川区平井2丁目,11-3
897300.0,Entire home apt,2,1.0,1.0,4.62, 台東区竜泉3丁目30-3, 台東区, 台東区竜泉3丁目,30-3
2400000.0,Private room,4,1.0,3.0,, 墨田区吾妻橋3丁目11-14, 墨田区, 墨田区吾妻橋3丁目,11-14
2571400.0,Entire home apt,6,2.0,2.0,4.75, 新宿区四谷4丁目13-8, 新宿区, 新宿区四谷4丁目,13-8
1451400.0,Private room,4,,2.0,4.28, 新宿区四谷4丁目15, 新宿区, 新宿区四谷4丁目,15
2108600.0,Private room,6,,3.0,4.38, 中野区弥生町1丁目21-3, 中野区, 中野区弥生町1丁目,21-3
874000.0,Entire home apt,2,1.0,1.0,4.43, 中野区弥生町1丁目21-11, 中野区, 中野区弥生町1丁目,21-11
794300.0,Entire home apt,2,1.0,,4.78, 中野区弥生町1丁目24-4, 中野区, 中野区弥生町1丁目,24-4
874000.0,Entire home apt,2,1.0,1.0,4.83,中野市弥生町１丁目−２１−２ エレガンス弥生Ｂ,中野市,中野市弥生町１丁目,−２１−２ エレガンス弥生Ｂ
874000.0,Entire home apt,2,1.0,1.0,4.0, 中野区弥生町1丁目30番12号, 中野区, 中野区弥生町1丁目,30番12号
874000.0,Entire home apt,2,1.0,1.0,4.61,中野市弥生町１丁目−３０−２ パティオ弥生町,中野市,中野市弥生町１丁目,−３０−２ パティオ弥生町
874000.0,Entire home apt,2,1.0,1.0,4.08, 中野区本町2丁目9番5号, 中野区, 中野区本町2丁目,9番5号
874000.0,Entire home apt,2,1.0,1.0,4.8, 中野区本町2丁目7番地, 中野区, 中野区本町2丁目,7番地
794300.0,Entire home apt,2,1.0,,4.69, 中野区弥生町1丁目21-7, 中野区, 中野区弥生町1丁目,21-7
794300.0,Entire home apt,2,1.0,,4.36, 中野区本町2丁目6-9, 中野区, 中野区本町2丁目,6-9
794300.0,Entire home apt,2,1.0,,4.77,豊島区巣鴨3丁目−5−19 Ｂｒｉｌｌｉａ巣鴨北山手賓館,豊島区,豊島区巣鴨3丁目,−5−19 Ｂｒｉｌｌｉａ巣鴨北山手賓館
842900.0,Entire home apt,2,1.0,1.0,4.8, 豊島区巣鴨3丁目30-8, 豊島区, 豊島区巣鴨3丁目,30-8
842900.0,Entire home apt,2,1.0,1.0,4.9,豊島区巣鴨3丁目−23−３ ハウス桃李 601,豊島区,豊島区巣鴨3丁目,−23−３ ハウス桃李 601
949100.0,Entire home apt,4,1.0,2.0,4.55,豊島区巣鴨3丁目−5−16 アパートメンツ巣鴨,豊島区,豊島区巣鴨3丁目,−5−16 アパートメンツ巣鴨
949100.0,Entire home apt,4,1.0,2.0,4.67, 江東区大島5丁目48-15, 江東区, 江東区大島5丁目,48-15
1632900.0,Entire home apt,4,2.0,3.0,4.78, 台東区千束2丁目35-2, 台東区, 台東区千束2丁目,35-2
2925700.0,Private room,6,1.0,4.0,4.75,調布市入間町３丁目−７−１１,調布市,調布市入間町３丁目,−７−１１
2785700.0,Private room,4,,4.0,5.0, 新宿区西新宿4丁目39-26, 新宿区, 新宿区西新宿4丁目,39-26
2000000.0,Entire home apt,4,1.0,2.0,4.77, 台東区千束2丁目35-2, 台東区, 台東区千束2丁目,35-2
833100.0,Private room,2,1.0,1.0,4.96, 台東区千束2丁目35-2, 台東区, 台東区千束2丁目,35-2
956600.0,Private room,2,1.0,1.0,5.0, 品川区南品川5丁目−11−３０ ホテルミレイ, 品川区, 品川区南品川5丁目,−11−３０ ホテルミレイ
1200000.0,Entire home apt,3,,2.0,4.88, 葛飾区堀切4丁目9-4, 葛飾区, 葛飾区堀切4丁目,9-4
2214000.0,Entire home apt,8,2.0,3.0,4.89, 台東区西浅草2丁目1-1 浅草一丁目（浅草1）, 台東区, 台東区西浅草2丁目,1-1 浅草一丁目（浅草1）
5188300.0,Private room,6,1.0,6.0,, 品川区南品川5丁目11-35, 品川区, 品川区南品川5丁目,11-35
3000000.0,Private room,5,2.0,5.0,4.94,品川区東大井5丁目−8−５トップ品川第３,品川区,品川区東大井5丁目,−8−５トップ品川第３
1200000.0,Private room,2,,2.0,4.88, 品川区南品川5丁目11-35, 品川区, 品川区南品川5丁目,11-35
1400000.0,Private room,4,,3.0,4.64, 目黒区目黒本町4丁目14-24, 目黒区, 目黒区目黒本町4丁目,14-24
1200000.0,Private room,3,1.0,3.0,4.2, 目黒区目黒本町1丁目10番10号, 目黒区, 目黒区目黒本町1丁目,10番10号
1400000.0,Private room,4,,4.0,4.17, 目黒区目黒本町1丁目6-10, 目黒区, 目黒区目黒本町1丁目,6-10
1500000.0,Private room,4,,2.0,4.5, 目黒区目黒本町1丁目6番6号 駐車場, 目黒区, 目黒区目黒本町1丁目,6番6号 駐車場
1000000.0,Private room,2,,1.0,3.75, 目黒区目黒本町1丁目6-17, 目黒区, 目黒区目黒本町1丁目,6-17
800000.0,Private room,2,,1.0,4.33, 目黒区目黒本町1丁目5-12, 目黒区, 目黒区目黒本町1丁目,5-12
800000.0,Private room,2,,1.0,4.33,武蔵野市吉祥寺本町1丁目−33−18 吉祥寺センチュリーマンシヨン,武蔵野市,武蔵野市吉祥寺本町1丁目,−33−18 吉祥寺センチュリーマンシヨン
1400000.0,Private room,3,1.0,2.0,5.0, 目黒区目黒本町4丁目−14 ハイムミサキ, 目黒区, 目黒区目黒本町4丁目,−14 ハイムミサキ
800000.0,Entire home apt,2,,1.0,4.75, 目黒区目黒本町2丁目1-20, 目黒区, 目黒区目黒本町2丁目,1-20
800000.0,Entire home apt,2,,1.0,5.0,目黒区目黒本町１丁目−６−８ ハイム津久井,目黒区,目黒区目黒本町１丁目,−６−８ ハイム津久井
800000.0,Entire home apt,2,,1.0,4.64, 目黒区目黒本町4丁目4-17, 目黒区, 目黒区目黒本町4丁目,4-17
800000.0,Private room,2,,1.0,4.5, 目黒区目黒本町2丁目1-20, 目黒区, 目黒区目黒本町2丁目,1-20
800000.0,Private room,2,,1.0,4.0, 目黒区目黒本町4丁目−9−15 木戸商店, 目黒区, 目黒区目黒本町4丁目,−9−15 木戸商店
800000.0,Private room,2,,1.0,4.83, 品川区西五反田8丁目10-14, 品川区, 品川区西五反田8丁目,10-14
1775700.0,Entire home apt,7,1.0,4.0,, 台東区千束2丁目35-2, 台東区, 台東区千束2丁目,35-2
1009100.0,Private room,2,1.0,1.0,4.5, 台東区千束2丁目35-2, 台東区, 台東区千束2丁目,35-2
1009100.0,Private room,2,1.0,1.0,5.0, 台東区千束2丁目35-2, 台東区, 台東区千束2丁目,35-2
1245700.0,Private room,4,1.0,2.0,5.0, 墨田区江東橋3丁目2-2, 墨田区, 墨田区江東橋3丁目,2-2
450000.0,Private room,1,1.0,1.0,4.76, 板橋区稲荷台8-7, 板橋区,, 板橋区稲荷台8-7
1800000.0,Entire home apt,6,2.0,3.0,5.0, 墨田区太平1丁目−8−４ 水野ビル1Ｆ, 墨田区, 墨田区太平1丁目,−8−４ 水野ビル1Ｆ
2000000.0,Entire home apt,2,1.0,2.0,, 新宿区大久保2丁目−13−５ 福華ビル, 新宿区, 新宿区大久保2丁目,−13−５ 福華ビル
1120000.0,Entire home apt,2,1.0,1.0,4.5, 墨田区東駒形3丁目−4−7 レイコロロビル１F, 墨田区, 墨田区東駒形3丁目,−4−7 レイコロロビル１F
1115900.0,Entire home apt,4,1.0,2.0,4.5, 大田区南蒲田3丁目10-7, 大田区, 大田区南蒲田3丁目,10-7
2500000.0,Entire home apt,6,2.0,3.0,4.57, 墨田区本所3丁目−9−６ キンセイ, 墨田区, 墨田区本所3丁目,−9−６ キンセイ
1164500.0,Entire home apt,4,1.0,2.0,4.17, 墨田区東駒形3丁目1-2, 墨田区, 墨田区東駒形3丁目,1-2
877900.0,Entire home apt,3,2.0,2.0,4.5, 墨田区本所3丁目17番1号, 墨田区, 墨田区本所3丁目,17番1号
877900.0,Entire home apt,3,2.0,2.0,4.78, 墨田区本所3丁目22番地 本所四丁目（本所4）, 墨田区, 墨田区本所3丁目,22番地 本所四丁目（本所4）
891300.0,Entire home apt,3,2.0,2.0,4.44, 墨田区本所3丁目17-6, 墨田区, 墨田区本所3丁目,17-6
1153600.0,Entire home apt,4,1.0,2.0,5.0, 豊島区西池袋3丁目18-6, 豊島区, 豊島区西池袋3丁目,18-6
1200000.0,Private room,4,1.0,1.0,3.5, 北区昭和町１丁目３−９ 尾久駅, 北区, 北区昭和町１丁目,３−９ 尾久駅
1214300.0,Entire home apt,2,2.0,2.0,4.44, 新宿区天神町７８ 小野沢マンション１Ｆ, 新宿区,, 新宿区天神町７８ 小野沢マンション１Ｆ
1800000.0,Private room,3,1.0,1.0,4.5, 墨田区亀沢4丁目22-15, 墨田区, 墨田区亀沢4丁目,22-15
1923400.0,Entire home apt,6,2.0,4.0,4.7, 渋谷区本町5丁目−27−10 角田マンション, 渋谷区, 渋谷区本町5丁目,−27−10 角田マンション
4435700.0,Entire home apt,10,4.0,6.0,4.44, 豊島区西巣鴨4丁目−8−43 西方寺, 豊島区, 豊島区西巣鴨4丁目,−8−43 西方寺
818600.0,Entire home apt,2,1.0,1.0,4.44, 豊島区西巣鴨3丁目−20−１ 7号館, 豊島区, 豊島区西巣鴨3丁目,−20−１ 7号館
953800.0,Entire home apt,4,1.0,2.0,4.9, 新宿区江の木町73-8, 新宿区,, 新宿区江の木町73-8
1800000.0,Private room,3,1.0,1.0,5.0, 新宿区江の木町72, 新宿区,, 新宿区江の木町72
1800000.0,Private room,3,1.0,1.0,4.67, 新宿区江の木町73-2 ブリズ神楽坂, 新宿区,, 新宿区江の木町73-2 ブリズ神楽坂
2160000.0,Private room,3,1.0,1.0,5.0, 新宿区江の木町50-3, 新宿区,, 新宿区江の木町50-3
1442900.0,Private room,3,1.0,1.0,4.59, 豊島区西巣鴨3丁目25番13号 西巣鴨駅, 豊島区, 豊島区西巣鴨3丁目,25番13号 西巣鴨駅
1014200.0,Entire home apt,4,1.0,2.0,4.43, 豊島区西巣鴨3丁目25-1, 豊島区, 豊島区西巣鴨3丁目,25-1
953800.0,Entire home apt,4,1.0,2.0,4.4, 豊島区西巣鴨3丁目25-12, 豊島区, 豊島区西巣鴨3丁目,25-12
1014200.0,Entire home apt,4,1.0,2.0,3.92, 港区赤坂2丁目13-23, 港区, 港区赤坂2丁目,13-23
2480000.0,Private room,8,8.0,8.0,3.2, 葛飾区金町2丁目11-1, 葛飾区, 葛飾区金町2丁目,11-1
1057100.0,Entire home apt,4,2.0,2.0,4.0, 豊島区池袋本町2丁目2-14, 豊島区, 豊島区池袋本町2丁目,2-14
6782100.0,Entire home apt,10,3.0,3.0,4.95, 葛飾区柴又3丁目−2−５ ダイヤパレス柴又205, 葛飾区, 葛飾区柴又3丁目,−2−５ ダイヤパレス柴又205
1042900.0,Entire home apt,4,2.0,3.0,3.33, 豊島区池袋2丁目62番7号, 豊島区, 豊島区池袋2丁目,62番7号
771300.0,Entire home apt,2,1.0,1.0,4.33,豊島区池袋2丁目−32−２２ クオリテイ,豊島区,豊島区池袋2丁目,−32−２２ クオリテイ
803600.0,Entire home apt,2,1.0,1.0,4.67, 豊島区池袋2丁目−69−６ ジック美容室, 豊島区, 豊島区池袋2丁目,−69−６ ジック美容室
828600.0,Entire home apt,3,1.0,1.0,4.13, 江東区亀戸7丁目42番地 亀戸7丁目西公園, 江東区, 江東区亀戸7丁目,42番地 亀戸7丁目西公園
742600.0,Entire home apt,2,1.0,1.0,4.57, 江東区亀戸7丁目19-6, 江東区, 江東区亀戸7丁目,19-6
835700.0,Entire home apt,2,1.0,1.0,4.79, 港区南麻布2丁目7-25, 港区, 港区南麻布2丁目,7-25
750000.0,Private room,2,,2.0,, 渋谷区幡ヶ谷2丁目−9−15 アムス幡ケ谷マンション, 渋谷区, 渋谷区幡ヶ谷2丁目,−9−15 アムス幡ケ谷マンション
1402400.0,Entire home apt,8,1.0,4.0,4.82, 墨田区緑1丁目1-13, 墨田区, 墨田区緑1丁目,1-13
1562900.0,Entire home apt,5,2.0,3.0,4.25, 豊島区上池袋3丁目15-14, 豊島区, 豊島区上池袋3丁目,15-14
880000.0,Entire home apt,4,1.0,2.0,5.0, 豊島区上池袋3丁目12-13, 豊島区, 豊島区上池袋3丁目,12-13
2228600.0,Entire home apt,8,3.0,5.0,4.53,豊島区上池袋３丁目−１６−１５ リヴェール池袋,豊島区,豊島区上池袋３丁目,−１６−１５ リヴェール池袋
1137100.0,Entire home apt,4,1.0,2.0,4.79, 豊島区上池袋3丁目22-6, 豊島区, 豊島区上池袋3丁目,22-6
1011400.0,Entire home apt,4,1.0,2.0,4.63, 豊島区上池袋4丁目29-9, 豊島区, 豊島区上池袋4丁目,29-9
1507100.0,Entire home apt,4,2.0,2.0,5.0, 豊島区上池袋3丁目20-15, 豊島区, 豊島区上池袋3丁目,20-15
950000.0,Entire home apt,4,1.0,2.0,4.5, 墨田区東駒形2丁目−3−13 こずめひろったビル, 墨田区, 墨田区東駒形2丁目,−3−13 こずめひろったビル
250000.0,Shared room,1,,1.0,4.33, 墨田区本所2丁目18-7, 墨田区, 墨田区本所2丁目,18-7
250000.0,Shared room,1,,1.0,4.25, 大田区上池台2丁目19番11号 駐車場, 大田区, 大田区上池台2丁目,19番11号 駐車場
295700.0,Private room,1,1.0,1.0,4.32, 大田区上池台2丁目31-14, 大田区, 大田区上池台2丁目,31-14
271400.0,Private room,1,1.0,1.0,4.23, 大田区上池台2丁目15-4, 大田区, 大田区上池台2丁目,15-4
267100.0,Private room,1,1.0,1.0,4.5, 港区南麻布2丁目7-25, 港区, 港区南麻布2丁目,7-25
750000.0,Private room,2,,2.0,5.0, 板橋区板橋1丁目−8−４ コトブキ第一ビル, 板橋区, 板橋区板橋1丁目,−8−４ コトブキ第一ビル
1500000.0,Entire home apt,5,1.0,2.0,4.0, 江東区東陽1丁目2-9, 江東区, 江東区東陽1丁目,2-9
557100.0,Entire home apt,1,1.0,,4.67, 新宿区新宿7丁目27-27, 新宿区, 新宿区新宿7丁目,27-27
1664300.0,Entire home apt,2,1.0,1.0,4.42, 江戸川区西小岩1丁目4-5, 江戸川区, 江戸川区西小岩1丁目,4-5
2514300.0,Private room,4,,,4.57, 墨田区向島3丁目34-11, 墨田区, 墨田区向島3丁目,34-11
1399900.0,Entire home apt,5,2.0,2.0,4.69, 江東区東陽1丁目21-2, 江東区, 江東区東陽1丁目,21-2
557100.0,Entire home apt,1,1.0,,4.93, 墨田区業平4丁目14-14, 墨田区, 墨田区業平4丁目,14-14
1871400.0,Entire home apt,4,1.0,2.0,4.55, 墨田区業平4丁目14-15, 墨田区, 墨田区業平4丁目,14-15
1014300.0,Entire home apt,3,1.0,2.0,4.63, 墨田区東駒形2丁目−13−13 毛塚ビル, 墨田区, 墨田区東駒形2丁目,−13−13 毛塚ビル
250000.0,Shared room,1,,1.0,5.0, 豊島区南大塚3丁目27-1, 豊島区, 豊島区南大塚3丁目,27-1
997500.0,Entire home apt,2,1.0,1.0,4.68, 杉並区高円寺北2丁目4-6, 杉並区, 杉並区高円寺北2丁目,4-6
1691400.0,Private room,2,1.0,2.0,4.79, 豊島区南大塚2丁目36-1101, 豊島区, 豊島区南大塚2丁目,36-1101
726600.0,Entire home apt,2,1.0,1.0,4.17, 新宿区歌舞伎町2丁目−41−11 広野ビル5F, 新宿区, 新宿区歌舞伎町2丁目,−41−11 広野ビル5F
2270000.0,Entire home apt,3,1.0,3.0,4.8, 新宿区中落合2丁目8-27, 新宿区, 新宿区中落合2丁目,8-27
1537100.0,Entire home apt,4,2.0,1.0,5.0, 江東区千田17-9, 江東区,, 江東区千田17-9
914300.0,Private room,1,1.0,1.0,4.52, 墨田区横川2丁目−14−9 クレヴィ, 墨田区, 墨田区横川2丁目,−14−9 クレヴィ
1072300.0,Entire home apt,3,1.0,1.0,4.53, 品川区南品川1丁目1-2, 品川区, 品川区南品川1丁目,1-2
5642900.0,Private room,4,2.0,2.0,, 墨田区横川2丁目12−２ ハーネス横川, 墨田区, 墨田区横川2丁目,12−２ ハーネス横川
2226600.0,Entire home apt,6,2.0,1.0,5.0, 新宿区歌舞伎町 2 丁目 10-16, 新宿区, 新宿区歌舞伎町 2 丁目, 10-16
2000000.0,Private room,2,1.0,1.0,5.0, 中央区銀座4丁目3-14, 中央区, 中央区銀座4丁目,3-14
3691400.0,Private room,2,1.0,1.0,, 世田谷区上馬1丁目32-17, 世田谷区, 世田谷区上馬1丁目,32-17
1777900.0,Entire home apt,4,1.0,2.0,4.75, 世田谷区上馬1丁目−32−３２番１０号 ハイツ三軒茶屋 7F, 世田谷区, 世田谷区上馬1丁目,−32−３２番１０号 ハイツ三軒茶屋 7F
1385700.0,Entire home apt,4,1.0,2.0,4.81, 世田谷区上馬1丁目32-10, 世田谷区, 世田谷区上馬1丁目,32-10
1071400.0,Entire home apt,4,1.0,1.0,4.55, 葛飾区細田5丁目22-3, 葛飾区, 葛飾区細田5丁目,22-3
2400000.0,Entire home apt,6,2.0,,5.0,墨田区亀沢１丁目−３−４ サンコーポ両国,墨田区,墨田区亀沢１丁目,−３−４ サンコーポ両国
934300.0,Entire home apt,2,1.0,2.0,4.86, 新宿区上落合2丁目7-13, 新宿区, 新宿区上落合2丁目,7-13
1650000.0,Entire home apt,6,2.0,2.0,4.22, 豊島区池袋1丁目31-13-304, 豊島区, 豊島区池袋1丁目,31-13-304
1400000.0,Entire home apt,3,,1.0,4.2, 墨田区立川1丁目2-2, 墨田区, 墨田区立川1丁目,2-2
12571400.0,Entire home apt,8,3.0,6.0,4.64, 台東区元浅草4丁目7-15, 台東区, 台東区元浅草4丁目,7-15
1788600.0,Private room,4,2.0,4.0,4.65, 新宿区北新宿3丁目4-8, 新宿区, 新宿区北新宿3丁目,4-8
1636400.0,Private room,3,,1.0,5.0, 新宿区大久保2丁目17-15, 新宿区, 新宿区大久保2丁目,17-15
5857100.0,Entire home apt,8,4.0,10.0,4.83,新宿区百人町２丁目−２１−９ シャルマン やよい,新宿区,新宿区百人町２丁目,−２１−９ シャルマン やよい
1071400.0,Entire home apt,2,1.0,1.0,4.4, 新宿区百人町2丁目15-1, 新宿区, 新宿区百人町2丁目,15-1
1257100.0,Entire home apt,2,1.0,1.0,4.8, 墨田区吾妻橋1丁目12-15, 墨田区, 墨田区吾妻橋1丁目,12-15
1328600.0,Entire home apt,4,1.0,2.0,4.96, 墨田区吾妻橋1丁目11-8, 墨田区, 墨田区吾妻橋1丁目,11-8
1385700.0,Entire home apt,4,1.0,2.0,4.85, 墨田区吾妻橋1丁目23-1, 墨田区, 墨田区吾妻橋1丁目,23-1
1200000.0,Entire home apt,3,1.0,2.0,4.8, 墨田区立川1丁目9-9, 墨田区, 墨田区立川1丁目,9-9
1578600.0,Entire home apt,7,3.0,4.0,4.0, 文京区小石川5丁目38-4, 文京区, 文京区小石川5丁目,38-4
400000.0,Private room,2,,1.0,4.78, 杉並区南荻窪4丁目44-5, 杉並区, 杉並区南荻窪4丁目,44-5
1100000.0,Entire home apt,7,2.0,2.0,4.5,町田市南つくし野１丁目−１２−１１,町田市,町田市南つくし野１丁目,−１２−１１
380000.0,Private room,1,,1.0,, 墨田区立川1丁目5-15, 墨田区, 墨田区立川1丁目,5-15
696400.0,Entire home apt,2,1.0,,, 世田谷区松原1丁目46, 世田谷区, 世田谷区松原1丁目,46
711600.0,Entire home apt,2,1.0,1.0,4.89, 府中市幸町２丁目−１９−２, 府中市, 府中市幸町２丁目,−１９−２
285000.0,Entire home apt,2,1.0,1.0,5.0, 港区新橋5丁目−36−11 浜ゴムビル3F, 港区, 港区新橋5丁目,−36−11 浜ゴムビル3F
324300.0,Shared room,1,,1.0,4.02, 墨田区立川1丁目3-5, 墨田区, 墨田区立川1丁目,3-5
696400.0,Entire home apt,2,1.0,,4.17,港区白金5丁目−8 ブリッジ白金,港区,港区白金5丁目,−8 ブリッジ白金
2785700.0,Entire home apt,6,2.0,4.0,4.6, 江戸川区平井2丁目12-7, 江戸川区, 江戸川区平井2丁目,12-7
995600.0,Private room,3,1.0,2.0,4.79, 杉並区下高井戸5丁目10-3, 杉並区, 杉並区下高井戸5丁目,10-3
2057100.0,Entire home apt,6,1.0,3.0,4.44, 中野区中野1丁目5番地, 中野区, 中野区中野1丁目,5番地
992900.0,Entire home apt,4,1.0,2.0,4.69, 江東区猿江2丁目16-8, 江東区, 江東区猿江2丁目,16-8
468600.0,Private room,1,,1.0,4.94,台東区洗足4丁目−23−９ ベル５番館,台東区,台東区洗足4丁目,−23−９ ベル５番館
712500.0,Entire home apt,2,1.0,1.0,4.86, 板橋区板橋1丁目32-8, 板橋区, 板橋区板橋1丁目,32-8
1200000.0,Entire home apt,3,1.0,1.0,4.6, 葛飾区東金町1丁目27-15, 葛飾区, 葛飾区東金町1丁目,27-15
602900.0,Entire home apt,1,1.0,1.0,5.0, 世田谷区三軒茶屋2丁目1番地, 世田谷区, 世田谷区三軒茶屋2丁目,1番地
1589300.0,Entire home apt,4,1.0,1.0,4.48, 北区上十条3丁目−11−２ ドリームハウス２, 北区, 北区上十条3丁目,−11−２ ドリームハウス２
2000000.0,Entire home apt,6,1.0,2.0,5.0, 新宿区大久保1丁目1-21, 新宿区, 新宿区大久保1丁目,1-21
1212900.0,Entire home apt,3,1.0,2.0,4.6, 豊島区西池袋2丁目30番6号, 豊島区, 豊島区西池袋2丁目,30番6号
722900.0,Entire home apt,3,1.0,1.0,5.0, 新宿区高田馬場3丁目21番地 山口コーポ, 新宿区, 新宿区高田馬場3丁目,21番地 山口コーポ
950000.0,Entire home apt,3,1.0,1.0,4.79,新宿区高田馬場３丁目−８−２１ メゾン中村,新宿区,新宿区高田馬場３丁目,−８−２１ メゾン中村
1250000.0,Entire home apt,4,1.0,2.0,4.67, 新宿区高田馬場3丁目16-17, 新宿区, 新宿区高田馬場3丁目,16-17
