price,room_type,accommodates,bedrooms,beds,review_scores_rating,address_japanese,shiku,townpart,detailpart
482300.0,Private room,1,1.0,1.0,3.71, 豊島区池袋1丁目−13−18 アイマスイマス池袋ビル3階, 豊島区, 豊島区池袋1丁目,−13−18 アイマスイマス池袋ビル3階
4642900.0,Entire home apt,10,3.0,6.0,4.8, 新宿区上落合3丁目13-3, 新宿区, 新宿区上落合3丁目,13-3
2428600.0,Entire home apt,5,1.0,2.0,4.67, 品川区北品川2丁目30-30, 品川区, 品川区北品川2丁目,30-30
1400000.0,Entire home apt,9,2.0,8.0,4.82, 墨田区緑2丁目11-18, 墨田区, 墨田区緑2丁目,11-18
728600.0,Private room,4,,3.0,4.44, 目黒区下目黒4丁目2-15, 目黒区, 目黒区下目黒4丁目,2-15
1650000.0,Entire home apt,3,2.0,2.0,4.67, 新宿区大久保1丁目1-9, 新宿区, 新宿区大久保1丁目,1-9
1494300.0,Entire home apt,4,1.0,4.0,4.59, 大田区羽田4丁目−3−9 Ｊ－ＣＲＥＳＴ羽田, 大田区, 大田区羽田4丁目,−3−9 Ｊ－ＣＲＥＳＴ羽田
1527100.0,Entire home apt,10,2.0,6.0,4.69, 北区東田端2丁目−8−７ 武藤ビル, 北区, 北区東田端2丁目,−8−７ 武藤ビル
1800000.0,Entire home apt,12,3.0,7.0,4.7, 豊島区東池袋2丁目8-6, 豊島区, 豊島区東池袋2丁目,8-6
1057100.0,Entire home apt,4,1.0,1.0,4.95, 江東区猿江2丁目4番地, 江東区, 江東区猿江2丁目,4番地
468600.0,Private room,1,,1.0,4.96, 墨田区墨田4丁目29-3, 墨田区, 墨田区墨田4丁目,29-3
814300.0,Entire home apt,6,1.0,,4.33, 新宿区歌舞伎町2丁目−6−６ 第2レオ寿マンション, 新宿区, 新宿区歌舞伎町2丁目,−6−６ 第2レオ寿マンション
955700.0,Entire home apt,2,1.0,,4.1, 墨田区墨田4丁目30番14号, 墨田区, 墨田区墨田4丁目,30番14号
773600.0,Entire home apt,6,1.0,,4.57, 墨田区墨田4丁目29-3, 墨田区, 墨田区墨田4丁目,29-3
773600.0,Entire home apt,6,1.0,,4.5, 墨田区墨田4丁目29-3, 墨田区, 墨田区墨田4丁目,29-3
773600.0,Entire home apt,6,1.0,,4.77, 墨田区墨田4丁目29-3, 墨田区, 墨田区墨田4丁目,29-3
814300.0,Entire home apt,6,2.0,,4.0, 墨田区墨田4丁目29-3, 墨田区, 墨田区墨田4丁目,29-3
2500000.0,Entire home apt,8,2.0,3.0,4.75, 葛飾区堀切3丁目−31−６ シースペース堀切, 葛飾区, 葛飾区堀切3丁目,−31−６ シースペース堀切
2111100.0,Entire home apt,5,2.0,2.0,4.43, 中野区中央3丁目3-3, 中野区, 中野区中央3丁目,3-3
2700000.0,Entire home apt,6,2.0,3.0,4.68, 港区東麻布1丁目30番10号, 港区, 港区東麻布1丁目,30番10号
3220000.0,Entire home apt,3,,2.0,4.78,世田谷区駒沢３丁目−21−１９ フラット緑泉公園,世田谷区,世田谷区駒沢３丁目,−21−１９ フラット緑泉公園
5966400.0,Entire home apt,16,10.0,10.0,, 渋谷区渋谷3丁目24-14, 渋谷区, 渋谷区渋谷3丁目,24-14
3385700.0,Entire home apt,7,1.0,5.0,4.53, 荒川区町屋8丁目6-8, 荒川区, 荒川区町屋8丁目,6-8
860000.0,Entire home apt,3,1.0,1.0,4.33, 渋谷区東1丁目−26−32 オムニービル, 渋谷区, 渋谷区東1丁目,−26−32 オムニービル
1314300.0,Entire home apt,2,1.0,1.0,4.5, 新宿区新宿1丁目−19−10 サンモールクレストB1, 新宿区, 新宿区新宿1丁目,−19−10 サンモールクレストB1
3619600.0,Private room,4,1.0,3.0,5.0, 新宿区新宿1丁目32番11号, 新宿区, 新宿区新宿1丁目,32番11号
3139500.0,Private room,4,1.0,2.0,5.0,江東区扇橋２丁目−９−８ 石川東京本社,江東区,江東区扇橋２丁目,−９−８ 石川東京本社
911100.0,Private room,4,,3.0,4.69, 江東区深川1丁目8-13, 江東区, 江東区深川1丁目,8-13
2326600.0,Private room,5,2.0,3.0,4.75, 足立区竹ノ塚1丁目−41−１ 川正ビル1F, 足立区, 足立区竹ノ塚1丁目,−41−１ 川正ビル1F
772300.0,Entire home apt,2,1.0,1.0,3.95, 豊島区上池袋3丁目12-15, 豊島区, 豊島区上池袋3丁目,12-15
1157100.0,Entire home apt,4,1.0,1.0,4.36, 豊島区上池袋3丁目16-17, 豊島区, 豊島区上池袋3丁目,16-17
1157100.0,Entire home apt,4,1.0,2.0,4.37, 台東区浅草2丁目18-4, 台東区, 台東区浅草2丁目,18-4
1125700.0,Private room,2,1.0,1.0,4.71, 台東区浅草2丁目18-4, 台東区, 台東区浅草2丁目,18-4
1125700.0,Private room,2,1.0,2.0,4.68, 新宿区高田馬場3丁目19-19, 新宿区, 新宿区高田馬場3丁目,19-19
2387300.0,Entire home apt,2,1.0,1.0,4.55,新宿区下落合1丁目−11−６ リバーサイドパレス落合,新宿区,新宿区下落合1丁目,−11−６ リバーサイドパレス落合
2641100.0,Entire home apt,2,1.0,1.0,4.68, 新宿区高田馬場3丁目19-6, 新宿区, 新宿区高田馬場3丁目,19-6
2641100.0,Entire home apt,3,1.0,1.0,4.7, 新宿区高田馬場3丁目−16−２ 第二コーポ安本103, 新宿区, 新宿区高田馬場3丁目,−16−２ 第二コーポ安本103
2387300.0,Entire home apt,3,1.0,1.0,4.0, 新宿区下落合1丁目8-8, 新宿区, 新宿区下落合1丁目,8-8
2387300.0,Entire home apt,3,1.0,1.0,4.56, 新宿区下落合1丁目−8−14 落合マンション, 新宿区, 新宿区下落合1丁目,−8−14 落合マンション
2387300.0,Entire home apt,3,1.0,1.0,4.4, 新宿区下落合1丁目−11−５ みなもとマンション, 新宿区, 新宿区下落合1丁目,−11−５ みなもとマンション
2387300.0,Entire home apt,3,1.0,1.0,5.0, 新宿区高田馬場3丁目15-5, 新宿区, 新宿区高田馬場3丁目,15-5
2387300.0,Entire home apt,3,1.0,1.0,5.0, 新宿区下落合1丁目−8−14 落合マンション, 新宿区, 新宿区下落合1丁目,−8−14 落合マンション
2641100.0,Entire home apt,3,1.0,1.0,4.42, 新宿区高田馬場3丁目21番地 めぐみハイツ, 新宿区, 新宿区高田馬場3丁目,21番地 めぐみハイツ
2387300.0,Entire home apt,3,1.0,1.0,4.5, 足立区竹ノ塚1丁目27, 足立区, 足立区竹ノ塚1丁目,27
672300.0,Entire home apt,1,1.0,,4.75, 新宿区高田馬場3丁目−18−25 第一第一康洋ビル 8階, 新宿区, 新宿区高田馬場3丁目,−18−25 第一第一康洋ビル 8階
2387300.0,Entire home apt,3,1.0,1.0,4.43, 新宿区下落合1丁目−8−14 落合マンション, 新宿区, 新宿区下落合1丁目,−8−14 落合マンション
2387300.0,Entire home apt,3,1.0,1.0,4.6, 新宿区高田馬場3丁目21-15, 新宿区, 新宿区高田馬場3丁目,21-15
2387300.0,Entire home apt,3,1.0,1.0,4.27, 新宿区高田馬場3丁目26-6, 新宿区, 新宿区高田馬場3丁目,26-6
2387300.0,Entire home apt,3,1.0,1.0,4.54, 新宿区下落合1丁目8-1, 新宿区, 新宿区下落合1丁目,8-1
2387300.0,Entire home apt,3,1.0,1.0,4.17, 新宿区下落合1丁目9-8, 新宿区, 新宿区下落合1丁目,9-8
2387300.0,Entire home apt,3,1.0,1.0,4.4, 新宿区高田馬場3丁目16-17, 新宿区, 新宿区高田馬場3丁目,16-17
2387300.0,Entire home apt,3,1.0,1.0,4.65, 新宿区高田馬場3丁目27-17, 新宿区, 新宿区高田馬場3丁目,27-17
2387300.0,Entire home apt,3,1.0,1.0,4.88, 新宿区高田馬場3丁目27-1, 新宿区, 新宿区高田馬場3丁目,27-1
2387300.0,Entire home apt,3,1.0,1.0,4.38, 新宿区高田馬場3丁目21番地 めぐみハイツ, 新宿区, 新宿区高田馬場3丁目,21番地 めぐみハイツ
2387300.0,Entire home apt,3,1.0,1.0,4.13, 新宿区高田馬場3丁目26-5-2, 新宿区, 新宿区高田馬場3丁目,26-5-2
2387300.0,Entire home apt,3,1.0,1.0,4.24, 新宿区下落合1丁目−8−２ シミズオクト落下合スタジオ, 新宿区, 新宿区下落合1丁目,−8−２ シミズオクト落下合スタジオ
2387300.0,Entire home apt,3,1.0,1.0,4.45, 新宿区高田馬場3丁目26-10, 新宿区, 新宿区高田馬場3丁目,26-10
2387300.0,Entire home apt,3,1.0,1.0,4.4, 新宿区下落合1丁目8-1, 新宿区, 新宿区下落合1丁目,8-1
2387300.0,Entire home apt,3,1.0,1.0,4.62, 新宿区下落合1丁目−8−14 落合マンション, 新宿区, 新宿区下落合1丁目,−8−14 落合マンション
2387300.0,Entire home apt,3,1.0,1.0,4.75, 新宿区高田馬場3丁目26-1, 新宿区, 新宿区高田馬場3丁目,26-1
2387300.0,Entire home apt,3,1.0,1.0,4.64, 新宿区高田馬場3丁目15-5, 新宿区, 新宿区高田馬場3丁目,15-5
2387300.0,Entire home apt,3,1.0,1.0,4.66,新宿区高田馬場３丁目−２７−７ タップダンスシティ,新宿区,新宿区高田馬場３丁目,−２７−７ タップダンスシティ
2387300.0,Entire home apt,3,1.0,1.0,4.64, 新宿区高田馬場3丁目−19−３ スタック高田馬場, 新宿区, 新宿区高田馬場3丁目,−19−３ スタック高田馬場
2387300.0,Entire home apt,3,1.0,1.0,4.75, 新宿区下落合1丁目8-13, 新宿区, 新宿区下落合1丁目,8-13
2387300.0,Entire home apt,3,1.0,1.0,4.29, 新宿区高田馬場3丁目27-2, 新宿区, 新宿区高田馬場3丁目,27-2
2387300.0,Entire home apt,3,1.0,1.0,4.63, 新宿区下落合1丁目−11−７ 落合エイコーマンション, 新宿区, 新宿区下落合1丁目,−11−７ 落合エイコーマンション
2387300.0,Entire home apt,3,1.0,1.0,4.63, 新宿区高田馬場3丁目16-17, 新宿区, 新宿区高田馬場3丁目,16-17
2387300.0,Entire home apt,3,1.0,1.0,4.61, 新宿区高田馬場3丁目25-9, 新宿区, 新宿区高田馬場3丁目,25-9
2387300.0,Entire home apt,3,1.0,1.0,4.4, 新宿区高田馬場3丁目14-7, 新宿区, 新宿区高田馬場3丁目,14-7
2387300.0,Entire home apt,3,1.0,1.0,4.6,新宿区高田馬場3丁目−17−２ 星川工務店,新宿区,新宿区高田馬場3丁目,−17−２ 星川工務店
2387300.0,Entire home apt,3,1.0,1.0,4.0, 新宿区高田馬場3丁目25-27-9, 新宿区, 新宿区高田馬場3丁目,25-27-9
2387300.0,Entire home apt,3,1.0,1.0,4.47, 新宿区高田馬場3丁目18-21, 新宿区, 新宿区高田馬場3丁目,18-21
2641100.0,Entire home apt,3,1.0,1.0,4.57, 新宿区高田馬場3丁目19-1, 新宿区, 新宿区高田馬場3丁目,19-1
2641100.0,Entire home apt,3,1.0,1.0,4.4, 新宿区高田馬場3丁目25-27, 新宿区, 新宿区高田馬場3丁目,25-27
2387300.0,Entire home apt,3,1.0,1.0,4.16, 新宿区高田馬場3丁目21-21, 新宿区, 新宿区高田馬場3丁目,21-21
2387300.0,Entire home apt,3,1.0,1.0,4.55, 新宿区高田馬場3丁目18-3 エルム高田馬場, 新宿区, 新宿区高田馬場3丁目,18-3 エルム高田馬場
2387300.0,Entire home apt,3,1.0,1.0,4.43, 新宿区高田馬場3丁目−14−３ 八達ビル1F, 新宿区, 新宿区高田馬場3丁目,−14−３ 八達ビル1F
2387300.0,Entire home apt,3,1.0,1.0,4.59, 新宿区高田馬場3丁目25-11, 新宿区, 新宿区高田馬場3丁目,25-11
2387300.0,Entire home apt,3,1.0,1.0,4.48, 新宿区高田馬場3丁目18-21, 新宿区, 新宿区高田馬場3丁目,18-21
2641100.0,Entire home apt,3,1.0,1.0,4.69, 江戸川区平井3丁目30-1, 江戸川区, 江戸川区平井3丁目,30-1
695900.0,Private room,4,1.0,4.0,4.94, 港区芝大門1丁目10-4, 港区, 港区芝大門1丁目,10-4
4321400.0,Entire home apt,4,1.0,4.0,4.7, 渋谷区渋谷3丁目9-6, 渋谷区, 渋谷区渋谷3丁目,9-6
1764300.0,Entire home apt,4,1.0,2.0,4.48,品川区平塚３丁目−１５−１０ アデッソ戸越銀座,品川区,品川区平塚３丁目,−１５−１０ アデッソ戸越銀座
1600000.0,Entire home apt,4,1.0,2.0,4.85, 墨田区亀沢1丁目27-3, 墨田区, 墨田区亀沢1丁目,27-3
1080000.0,Shared room,3,,3.0,4.33,新宿区大久保１丁目−４ グリーンコーポラス,新宿区,新宿区大久保１丁目,−４ グリーンコーポラス
1312000.0,Entire home apt,2,1.0,1.0,4.89, 新宿区新宿1丁目−32−11 日東ビル, 新宿区, 新宿区新宿1丁目,−32−11 日東ビル
3692200.0,Private room,4,1.0,3.0,4.71, 中野区沼袋2丁目19-27, 中野区, 中野区沼袋2丁目,19-27
2252900.0,Entire home apt,6,2.0,,, 新宿区百人町2丁目20番10号Hikari.III, 新宿区, 新宿区百人町2丁目,20番10号Hikari.III
1100000.0,Entire home apt,4,1.0,2.0,4.6, 江戸川区平井3丁目29-29, 江戸川区, 江戸川区平井3丁目,29-29
706400.0,Private room,4,1.0,4.0,4.87, 新宿区百人町2丁目19-14, 新宿区, 新宿区百人町2丁目,19-14
1100000.0,Entire home apt,4,1.0,2.0,4.5,新宿区西五軒町8−17 岡村ビルB1 神楽坂五軒町オフィス１号室,新宿区,,新宿区西五軒町8−17 岡村ビルB1 神楽坂五軒町オフィス１号室
2836400.0,Entire home apt,8,2.0,7.0,4.49, 新宿区西五軒町8-17-5, 新宿区,, 新宿区西五軒町8-17-5
2850000.0,Entire home apt,8,2.0,6.0,4.69, 新宿区百人町2丁目21-27, 新宿区, 新宿区百人町2丁目,21-27
1200000.0,Entire home apt,4,1.0,2.0,4.64,江戸川区平井３丁目−４−７ 都営平井１丁目アパート７号棟,江戸川区,江戸川区平井３丁目,−４−７ 都営平井１丁目アパート７号棟
833000.0,Private room,6,1.0,4.0,4.78, 中野区中野1丁目12-7, 中野区, 中野区中野1丁目,12-7
4234200.0,Entire home apt,15,5.0,9.0,4.56, 江戸川区平井3丁目−29−７ ヴェルト平井, 江戸川区, 江戸川区平井3丁目,−29−７ ヴェルト平井
695900.0,Private room,2,1.0,1.0,4.89, 江戸川区平井3丁目−17−13 杜の癒しハウスひらい, 江戸川区, 江戸川区平井3丁目,−17−13 杜の癒しハウスひらい
833000.0,Private room,6,1.0,4.0,4.84, 中野区弥生町1丁目21-7, 中野区, 中野区弥生町1丁目,21-7
822700.0,Entire home apt,2,1.0,1.0,4.21,新宿区西新宿5丁目−12−１１ インペリアル細谷,新宿区,新宿区西新宿5丁目,−12−１１ インペリアル細谷
2027900.0,Entire home apt,4,1.0,2.0,4.35,新宿区西新宿5丁目−12−12 カーサセンザン,新宿区,新宿区西新宿5丁目,−12−12 カーサセンザン
2746700.0,Entire home apt,8,2.0,4.0,4.64, 江戸川区平井3丁目17-17, 江戸川区, 江戸川区平井3丁目,17-17
706400.0,Private room,4,1.0,4.0,4.78, 墨田区石原1丁目15-2, 墨田区, 墨田区石原1丁目,15-2
7000000.0,Shared room,6,,5.0,, 墨田区東向島2丁目24-2, 墨田区, 墨田区東向島2丁目,24-2
880000.0,Entire home apt,6,2.0,4.0,4.67, 台東区上野3丁目29-3 上野広小路駅, 台東区, 台東区上野3丁目,29-3 上野広小路駅
34404300.0,Entire home apt,5,2.0,2.0,3.0, 台東区日本堤2丁目−3−２ ジェノヴィア三ノ輪IIスカイガーデン, 台東区, 台東区日本堤2丁目,−3−２ ジェノヴィア三ノ輪IIスカイガーデン
2061000.0,Entire home apt,5,2.0,2.0,4.77, 豊島区駒込3丁目3-22, 豊島区, 豊島区駒込3丁目,3-22
3357100.0,Entire home apt,7,3.0,3.0,4.46, 文京区本駒込6丁目17-15, 文京区, 文京区本駒込6丁目,17-15
3442900.0,Entire home apt,8,3.0,5.0,4.83, 豊島区南大塚1丁目−23−１ 千葉工芸, 豊島区, 豊島区南大塚1丁目,−23−１ 千葉工芸
1382900.0,Entire home apt,3,1.0,2.0,4.93, 豊島区南大塚1丁目46-4, 豊島区, 豊島区南大塚1丁目,46-4
1681700.0,Entire home apt,3,1.0,2.0,4.65,大田区玉川１丁目−６、安方商店街,大田区,大田区玉川１丁目,−６、安方商店街
1581100.0,Entire home apt,7,1.0,7.0,4.98, 台東区浅草2丁目−25−２ フォレスタ浅草, 台東区, 台東区浅草2丁目,−25−２ フォレスタ浅草
1111300.0,Private room,2,1.0,2.0,, 墨田区業平3丁目17-6, 墨田区, 墨田区業平3丁目,17-6
2825700.0,Entire home apt,8,1.0,5.0,4.76, 墨田区押上1丁目−19−１ 石野ビル, 墨田区, 墨田区押上1丁目,−19−１ 石野ビル
1942900.0,Entire home apt,5,1.0,4.0,4.72, 墨田区押上1丁目8-25, 墨田区, 墨田区押上1丁目,8-25
2100000.0,Entire home apt,4,1.0,3.0,4.71, 中野区南台1丁目5-8, 中野区, 中野区南台1丁目,5-8
1320600.0,Entire home apt,4,1.0,2.0,4.87, 葛飾区東立石2丁目14-17, 葛飾区, 葛飾区東立石2丁目,14-17
3142900.0,Entire home apt,12,4.0,4.0,4.85, 台東区清川1丁目5-12, 台東区, 台東区清川1丁目,5-12
1695000.0,Entire home apt,3,1.0,,4.5,モービル。  港区芝1丁目13-19,モービル。  港区,モービル。  港区芝1丁目,13-19
4635700.0,Entire home apt,6,1.0,6.0,4.8,モービル。  港区芝1丁目13-19,モービル。  港区,モービル。  港区芝1丁目,13-19
4635700.0,Entire home apt,5,1.0,5.0,4.6, 豊島区東池袋2丁目52番2号, 豊島区, 豊島区東池袋2丁目,52番2号
1702900.0,Entire home apt,7,1.0,4.0,4.49, 新宿区上落合3丁目1-6, 新宿区, 新宿区上落合3丁目,1-6
1962900.0,Entire home apt,8,2.0,4.0,4.82, 豊島区西池袋5丁目24番3号, 豊島区, 豊島区西池袋5丁目,24番3号
3085700.0,Entire home apt,6,3.0,4.0,4.74, 江東区亀戸3丁目57-3, 江東区, 江東区亀戸3丁目,57-3
3100000.0,Entire home apt,8,3.0,6.0,4.72, 墨田区両国3丁目−20−３ ベルメゾン両国, 墨田区, 墨田区両国3丁目,−20−３ ベルメゾン両国
1742900.0,Entire home apt,6,2.0,5.0,4.25, 新宿区西新宿5丁目5-23, 新宿区, 新宿区西新宿5丁目,5-23
2117900.0,Entire home apt,4,1.0,2.0,4.56, 渋谷区本町3丁目25番5号, 渋谷区, 渋谷区本町3丁目,25番5号
2324300.0,Entire home apt,6,1.0,3.0,4.45, 新宿区西新宿5丁目4-20, 新宿区, 新宿区西新宿5丁目,4-20
2620700.0,Entire home apt,8,2.0,4.0,4.77, 渋谷区初台1丁目32-25, 渋谷区, 渋谷区初台1丁目,32-25
694600.0,Entire home apt,4,1.0,2.0,4.14, 渋谷区幡ヶ谷3丁目54-3, 渋谷区, 渋谷区幡ヶ谷3丁目,54-3
1200000.0,Entire home apt,2,1.0,1.0,4.58, 豊島区池袋3丁目28番19号, 豊島区, 豊島区池袋3丁目,28番19号
2192500.0,Entire home apt,5,2.0,5.0,4.6, 渋谷区本町6丁目39-7, 渋谷区, 渋谷区本町6丁目,39-7
850000.0,Entire home apt,2,1.0,1.0,5.0, 新宿区西新宿4丁目−37−16 1F, 新宿区, 新宿区西新宿4丁目,−37−16 1F
1996700.0,Private room,4,1.0,2.0,4.83, 港区南青山7丁目12-16, 港区, 港区南青山7丁目,12-16
10000000.0,Private room,4,,3.0,5.0, 渋谷区本町1丁目4-4, 渋谷区, 渋谷区本町1丁目,4-4
2089700.0,Private room,2,,1.0,4.9, 新宿区高田馬場3丁目19-10, 新宿区, 新宿区高田馬場3丁目,19-10
3068500.0,Entire home apt,3,1.0,1.0,4.4, 渋谷区道玄坂2丁目13-5 ハーベストビル, 渋谷区, 渋谷区道玄坂2丁目,13-5 ハーベストビル
2500000.0,Entire home apt,3,1.0,3.0,, 渋谷区円山町2−9 第２ＳＵＮＸビル, 渋谷区,, 渋谷区円山町2−9 第２ＳＵＮＸビル
2500000.0,Entire home apt,4,1.0,2.0,,大田区西糀谷２丁目−２７−９ 三浦工業羽田営業所,大田区,大田区西糀谷２丁目,−２７−９ 三浦工業羽田営業所
1857100.0,Entire home apt,8,2.0,4.0,4.61, 新宿区天神町27-3, 新宿区,, 新宿区天神町27-3
1943100.0,Private room,4,1.0,2.0,4.88, 新宿区天神町30, 新宿区,, 新宿区天神町30
2931100.0,Private room,5,1.0,3.0,5.0, 墨田区東向島2丁目36-36, 墨田区, 墨田区東向島2丁目,36-36
550000.0,Private room,4,1.0,2.0,4.75, 新宿区天神町26, 新宿区,, 新宿区天神町26
2174000.0,Private room,5,1.0,3.0,4.79, 新宿区矢来町27, 新宿区,, 新宿区矢来町27
2766600.0,Private room,6,1.0,4.0,4.82, 新宿区山吹町298, 新宿区,, 新宿区山吹町298
3108000.0,Private room,6,1.0,4.0,4.82, 新宿区東榎町4, 新宿区,, 新宿区東榎町4
4491000.0,Private room,8,1.0,6.0,4.91, 新宿区中里町29番3号 菱秀神楽坂ビル9F IBCパブリッシング株式会社内, 新宿区,, 新宿区中里町29番3号 菱秀神楽坂ビル9F IBCパブリッシング株式会社内
2967400.0,Private room,6,1.0,4.0,4.82, 豊島区池袋2丁目40番14号, 豊島区, 豊島区池袋2丁目,40番14号
2192500.0,Entire home apt,5,2.0,5.0,4.71, 豊島区池袋2丁目57番12号, 豊島区, 豊島区池袋2丁目,57番12号
1817800.0,Entire home apt,4,2.0,4.0,5.0, 豊島区上池袋3丁目5-7, 豊島区, 豊島区上池袋3丁目,5-7
2668300.0,Entire home apt,7,3.0,6.0,4.78,豊島区上池袋3丁目−29−３ 伏見荘,豊島区,豊島区上池袋3丁目,−29−３ 伏見荘
1512800.0,Entire home apt,2,1.0,2.0,5.0,新宿区西新宿4丁目−24−２０ ホームズシイーリエ,新宿区,新宿区西新宿4丁目,−24−２０ ホームズシイーリエ
1558100.0,Private room,2,1.0,1.0,4.62, 荒川区東尾久1丁目28-2, 荒川区, 荒川区東尾久1丁目,28-2
1095800.0,Private room,4,1.0,2.0,4.81, 渋谷区本町1丁目4-4, 渋谷区, 渋谷区本町1丁目,4-4
1284100.0,Private room,2,1.0,2.0,4.88,上大崎橋 目黒駅  品川区上大崎2丁目16番16号,上大崎橋 目黒駅  品川区,上大崎橋 目黒駅  品川区上大崎2丁目,16番16号
2357100.0,Entire home apt,2,1.0,1.0,4.87, 新宿区西新宿4丁目−24−７ マイプラン西新宿B, 新宿区, 新宿区西新宿4丁目,−24−７ マイプラン西新宿B
1786400.0,Private room,4,1.0,2.0,4.81, 新宿区西新宿4丁目36-7, 新宿区, 新宿区西新宿4丁目,36-7
1382400.0,Private room,2,1.0,1.0,5.0, 墨田区吾妻橋2丁目−1−６ 1F, 墨田区, 墨田区吾妻橋2丁目,−1−６ 1F
1186400.0,Entire home apt,6,1.0,3.0,4.78, 墨田区吾妻橋2丁目1-4, 墨田区, 墨田区吾妻橋2丁目,1-4
1392500.0,Entire home apt,6,1.0,3.0,4.82, 台東区東上野 1 丁目 27-11, 台東区, 台東区東上野 1 丁目, 27-11
4572900.0,Entire home apt,4,1.0,4.0,4.76,新宿区新宿7丁目−26−９ 東京社会保険会館フィオーレ東京,新宿区,新宿区新宿7丁目,−26−９ 東京社会保険会館フィオーレ東京
7542900.0,Private room,5,,3.0,4.69, 台東区東上野 1 丁目 27-11, 台東区, 台東区東上野 1 丁目, 27-11
4902900.0,Entire home apt,5,1.0,5.0,5.0, 新宿区新宿7丁目26-23 204, 新宿区, 新宿区新宿7丁目,26-23 204
7542900.0,Private room,5,,3.0,4.93, 台東区東上野 1 丁目 27-11, 台東区, 台東区東上野 1 丁目, 27-11
4667100.0,Entire home apt,2,1.0,1.0,4.6, 台東区東上野 1 丁目 27-11, 台東区, 台東区東上野 1 丁目, 27-11
4997100.0,Entire home apt,2,1.0,1.0,5.0, 渋谷区本町4丁目−4−11 本町マンション, 渋谷区, 渋谷区本町4丁目,−4−11 本町マンション
771400.0,Entire home apt,2,1.0,2.0,4.81, 渋谷区本町2丁目33-8, 渋谷区, 渋谷区本町2丁目,33-8
700000.0,Entire home apt,1,1.0,1.0,4.89, 渋谷区本町4丁目36-8, 渋谷区, 渋谷区本町4丁目,36-8
785700.0,Entire home apt,2,1.0,2.0,4.93, 渋谷区本町2丁目36番1号, 渋谷区, 渋谷区本町2丁目,36番1号
871400.0,Entire home apt,2,1.0,2.0,4.89, 墨田区亀沢1丁目17-2, 墨田区, 墨田区亀沢1丁目,17-2
2000000.0,Entire home apt,4,1.0,4.0,4.95,新宿区大久保１丁目−７−７ 黒田製作所,新宿区,新宿区大久保１丁目,−７−７ 黒田製作所
50000000.0,Entire home apt,6,1.0,6.0,5.0,アーデン東新宿  新宿区大久保1丁目14-2,アーデン東新宿  新宿区,アーデン東新宿  新宿区大久保1丁目,14-2
50000000.0,Entire home apt,6,1.0,6.0,4.92,新宿区大久保１丁目−７ 竹村コーポサカエ,新宿区,新宿区大久保１丁目,−７ 竹村コーポサカエ
50000000.0,Entire home apt,6,1.0,6.0,4.67,新宿区大久保１丁目−７−７ 黒田製作所,新宿区,新宿区大久保１丁目,−７−７ 黒田製作所
50000000.0,Entire home apt,6,1.0,6.0,5.0, 新宿区大久保1丁目−1−15 ベルバウム, 新宿区, 新宿区大久保1丁目,−1−15 ベルバウム
50000000.0,Entire home apt,6,1.0,6.0,4.8, 新宿区歌舞伎町 2 丁目 31-9, 新宿区, 新宿区歌舞伎町 2 丁目, 31-9
50000000.0,Entire home apt,6,1.0,6.0,4.78,新宿区大久保1丁目−12−６ サンセール新宿,新宿区,新宿区大久保1丁目,−12−６ サンセール新宿
50000000.0,Entire home apt,6,1.0,6.0,4.82, 新宿区大久保1丁目−13−４ 矢野マンション, 新宿区, 新宿区大久保1丁目,−13−４ 矢野マンション
50000000.0,Entire home apt,6,1.0,6.0,4.14,新宿区西新宿4丁目−25−２ ハイムコスモス,新宿区,新宿区西新宿4丁目,−25−２ ハイムコスモス
8900000.0,Private room,16,6.0,10.0,, 新宿区西新宿4丁目41-3, 新宿区, 新宿区西新宿4丁目,41-3
1645000.0,Private room,3,1.0,2.0,4.8, 新宿区西新宿 4 丁目 24-11, 新宿区, 新宿区西新宿 4 丁目, 24-11
1711700.0,Private room,4,1.0,2.0,4.57, 北区田端新町2丁目−31−７ ひばり荘, 北区, 北区田端新町2丁目,−31−７ ひばり荘
1286500.0,Private room,4,1.0,2.0,4.72, 北区田端新町2丁目27-17, 北区, 北区田端新町2丁目,27-17
652800.0,Private room,2,1.0,1.0,4.82, 荒川区東尾久1丁目36-3, 荒川区, 荒川区東尾久1丁目,36-3
1501000.0,Private room,3,1.0,1.0,4.81,新宿区高田馬場3丁目−20−８山中館,新宿区,新宿区高田馬場3丁目,−20−８山中館
3068500.0,Entire home apt,3,1.0,1.0,4.5,新宿区高田馬場3丁目−26−１３ 半沢荘,新宿区,新宿区高田馬場3丁目,−26−１３ 半沢荘
3068500.0,Entire home apt,3,1.0,1.0,5.0, 新宿区下落合1丁目−8−２ シミズオクト落下合スタジオ, 新宿区, 新宿区下落合1丁目,−8−２ シミズオクト落下合スタジオ
3068500.0,Entire home apt,3,1.0,1.0,4.75, 新宿区高田馬場3丁目16-4, 新宿区, 新宿区高田馬場3丁目,16-4
3068500.0,Entire home apt,3,1.0,,5.0, 新宿区下落合1丁目8-1, 新宿区, 新宿区下落合1丁目,8-1
3068500.0,Entire home apt,3,1.0,1.0,4.0,新宿区高田馬場3丁目−19−18 千代田荘,新宿区,新宿区高田馬場3丁目,−19−18 千代田荘
3068500.0,Entire home apt,3,1.0,1.0,4.67, 新宿区高田馬場3丁目21-13, 新宿区, 新宿区高田馬場3丁目,21-13
3068500.0,Entire home apt,3,1.0,1.0,5.0, 新宿区高田馬場3丁目−16−２ 第二コーポ, 新宿区, 新宿区高田馬場3丁目,−16−２ 第二コーポ
