price,room_type,accommodates,bedrooms,beds,review_scores_rating,address_japanese,shiku,townpart,detailpart
984300.0,Entire home apt,5,1.0,3.0,4.5, 豊島区上池袋2丁目5-1, 豊島区, 豊島区上池袋2丁目,5-1
1199300.0,Entire home apt,4,1.0,2.0,4.38, 北区神谷2丁目24-4, 北区, 北区神谷2丁目,24-4
1970000.0,Entire home apt,6,1.0,3.0,4.8, 港区赤坂5丁目1-33, 港区, 港区赤坂5丁目,1-33
386800.0,Private room,2,,2.0,4.86, 墨田区横川3丁目6-1, 墨田区, 墨田区横川3丁目,6-1
464300.0,Hotel room,1,1.0,8.0,4.84, 台東区下谷2丁目13-21, 台東区, 台東区下谷2丁目,13-21
3408600.0,Entire home apt,8,4.0,4.0,4.36, 新宿区百人町2丁目22-13, 新宿区, 新宿区百人町2丁目,22-13
2071400.0,Hotel room,2,2.0,1.0,4.87, 台東区下谷2丁目13-21, 台東区, 台東区下谷2丁目,13-21
2214300.0,Entire home apt,9,3.0,4.0,4.75, 豊島区東池袋2丁目51-4, 豊島区, 豊島区東池袋2丁目,51-4
1642900.0,Entire home apt,2,1.0,1.0,4.82, 新宿区北新宿1丁目17-12, 新宿区, 新宿区北新宿1丁目,17-12
1457100.0,Entire home apt,2,1.0,1.0,4.87, 中野区本町2丁目19-16, 中野区, 中野区本町2丁目,19-16
1157100.0,Entire home apt,3,1.0,,5.0, 墨田区東駒形3丁目11-11-6, 墨田区, 墨田区東駒形3丁目,11-11-6
417900.0,Entire home apt,1,1.0,1.0,5.0, 多摩市落川1329, 多摩市,, 多摩市落川1329
400000.0,Private room,4,1.0,,4.0, 国立市谷保4278, 国立市,, 国立市谷保4278
600000.0,Entire home apt,3,1.0,2.0,4.73,文京区千駄木3丁目−46−２ レックサービス千駄木ビル,文京区,文京区千駄木3丁目,−46−２ レックサービス千駄木ビル
18737100.0,Entire home apt,5,2.0,4.0,4.67, 豊島区巣鴨5丁目2-5, 豊島区, 豊島区巣鴨5丁目,2-5
2523900.0,Entire home apt,5,1.0,1.0,4.43, 荒川区荒川4丁目35-16, 荒川区, 荒川区荒川4丁目,35-16
3000000.0,Entire home apt,10,3.0,6.0,4.58, 葛飾区西新小岩4丁目13-9, 葛飾区, 葛飾区西新小岩4丁目,13-9
485700.0,Private room,1,1.0,1.0,4.38, 墨田区東駒形1丁目10-1, 墨田区, 墨田区東駒形1丁目,10-1
585700.0,Private room,2,1.0,1.0,4.47, 墨田区東駒形1丁目6-8, 墨田区, 墨田区東駒形1丁目,6-8
1291100.0,Entire home apt,3,1.0,2.0,4.83, 港区南青山1丁目11-36, 港区, 港区南青山1丁目,11-36
470000.0,Private room,1,1.0,1.0,4.96, 豊島区池袋本町2丁目6-3, 豊島区, 豊島区池袋本町2丁目,6-3
1085700.0,Entire home apt,7,2.0,2.0,4.71, 墨田区京島3丁目13-7, 墨田区, 墨田区京島3丁目,13-7
980000.0,Entire home apt,4,1.0,1.0,4.6, 墨田区八広2丁目17-14, 墨田区, 墨田区八広2丁目,17-14
1650000.0,Entire home apt,6,2.0,2.0,4.63, 新宿区中落合1丁目12-16, 新宿区, 新宿区中落合1丁目,12-16
3468600.0,Entire home apt,6,1.0,3.0,4.79, 千代田区神田和泉町1-3-8, 千代田区,, 千代田区神田和泉町1-3-8
500000.0,Private room,4,,,3.57, 新宿区西早稲田2丁目8-26, 新宿区, 新宿区西早稲田2丁目,8-26
988600.0,Entire home apt,3,1.0,2.0,, 台東区西浅草1丁目1-18 田原町駅, 台東区, 台東区西浅草1丁目,1-18 田原町駅
1084300.0,Entire home apt,2,1.0,1.0,4.73, 北区神谷2丁目−17−9 フラワーハウス, 北区, 北区神谷2丁目,−17−9 フラワーハウス
1199300.0,Entire home apt,4,1.0,2.0,4.46, 北区神谷2丁目20-6, 北区, 北区神谷2丁目,20-6
1150000.0,Entire home apt,4,1.0,2.0,4.53, 北区神谷2丁目25-14, 北区, 北区神谷2丁目,25-14
1412900.0,Entire home apt,5,2.0,3.0,4.54, 北区神谷2丁目24-5, 北区, 北区神谷2丁目,24-5
1396400.0,Entire home apt,5,1.0,3.0,4.4, 北区赤羽西1丁目23-7, 北区, 北区赤羽西1丁目,23-7
1396400.0,Entire home apt,5,1.0,3.0,4.52, 北区赤羽西1丁目−24−２８ コーポフジ, 北区, 北区赤羽西1丁目,−24−２８ コーポフジ
1429300.0,Entire home apt,6,1.0,3.0,4.67, 北区赤羽西4丁目3-9, 北区, 北区赤羽西4丁目,3-9
1396400.0,Entire home apt,5,1.0,3.0,4.55, 北区赤羽西4丁目4-10, 北区, 北区赤羽西4丁目,4-10
1511400.0,Entire home apt,6,1.0,3.0,4.53, 北区赤羽西2丁目14-20, 北区, 北区赤羽西2丁目,14-20
1429300.0,Entire home apt,6,1.0,3.0,4.57, 北区赤羽西2丁目10-14, 北区, 北区赤羽西2丁目,10-14
1396400.0,Entire home apt,5,1.0,3.0,4.41,北区赤羽西４丁目−１−４ ハイツ志賀,北区,北区赤羽西４丁目,−１−４ ハイツ志賀
1429300.0,Entire home apt,6,1.0,3.0,4.62, 北区赤羽西2丁目14-5, 北区, 北区赤羽西2丁目,14-5
1396400.0,Entire home apt,5,1.0,3.0,4.43, 北区赤羽西1丁目23-9, 北区, 北区赤羽西1丁目,23-9
1680000.0,Entire home apt,6,2.0,2.0,4.74, 新宿区中落合1丁目20-8, 新宿区, 新宿区中落合1丁目,20-8
3500000.0,Entire home apt,11,3.0,5.0,5.0,豊島区駒込6丁目−11−15 赤城荘,豊島区,豊島区駒込6丁目,−11−15 赤城荘
2400000.0,Entire home apt,8,1.0,2.0,5.0, 江東区大島3丁目15-31, 江東区, 江東区大島3丁目,15-31
534100.0,Entire home apt,6,1.0,2.0,4.65, 新宿区中落合1丁目−11−9 みゆきマンション, 新宿区, 新宿区中落合1丁目,−11−9 みゆきマンション
342200.0,Entire home apt,4,1.0,,4.8, 新宿区中落合1丁目15-6, 新宿区, 新宿区中落合1丁目,15-6
1837100.0,Hotel room,4,,1.0,4.84, 新宿区内藤町4丁目9-12, 新宿区, 新宿区内藤町4丁目,9-12
2400000.0,Entire home apt,8,1.0,1.0,4.88, 江東区大島4丁目14-7, 江東区, 江東区大島4丁目,14-7
2503500.0,Entire home apt,6,1.0,3.0,4.26, 新宿区大久保1丁目4-3, 新宿区, 新宿区大久保1丁目,4-3
980000.0,Entire home apt,6,2.0,1.0,4.75, 墨田区八広2丁目1-15, 墨田区, 墨田区八広2丁目,1-15
990000.0,Entire home apt,6,2.0,1.0,4.82, 墨田区京島3丁目21-2, 墨田区, 墨田区京島3丁目,21-2
871400.0,Entire home apt,2,1.0,,4.21,新宿区百人町２丁目−２２−１２ シェソワ百人町,新宿区,新宿区百人町２丁目,−２２−１２ シェソワ百人町
1500000.0,Private room,3,,3.0,5.0, 武蔵野市吉祥寺本町1丁目34-5, 武蔵野市, 武蔵野市吉祥寺本町1丁目,34-5
5114300.0,Entire home apt,16,3.0,4.0,4.41,新宿区西新宿3丁目−8−３ 新都心丸善ビル,新宿区,新宿区西新宿3丁目,−8−３ 新都心丸善ビル
996400.0,Entire home apt,3,1.0,1.0,4.73, 港区麻布十番2丁目−1−2F クーツグリーンティー麻布十番店, 港区, 港区麻布十番2丁目,−1−2F クーツグリーンティー麻布十番店
1292800.0,Entire home apt,2,,1.0,4.1,新宿区歌舞伎町２丁目−６−１６ パレドール歌舞伎町第２,新宿区,新宿区歌舞伎町２丁目,−６−１６ パレドール歌舞伎町第２
1691800.0,Entire home apt,3,1.0,1.0,4.21, 新宿区新宿7丁目26-25, 新宿区, 新宿区新宿7丁目,26-25
1243400.0,Entire home apt,2,1.0,1.0,3.83, 新宿区歌舞伎町 2 丁目 15-11, 新宿区, 新宿区歌舞伎町 2 丁目, 15-11
4839400.0,Entire home apt,7,2.0,4.0,4.51, 新宿区新宿6丁目27-41, 新宿区, 新宿区新宿6丁目,27-41
6101800.0,Entire home apt,10,3.0,4.0,3.95,新宿区歌舞伎町２丁目−４−３ ノア新宿２号館,新宿区,新宿区歌舞伎町２丁目,−４−３ ノア新宿２号館
400000.0,Private room,2,,2.0,4.75, 台東区三ノ輪1丁目4-2, 台東区, 台東区三ノ輪1丁目,4-2
1428600.0,Entire home apt,8,2.0,7.0,4.85, 台東区三ノ輪1丁目−19−２ ビエナ三ノ輪, 台東区, 台東区三ノ輪1丁目,−19−２ ビエナ三ノ輪
1608600.0,Entire home apt,2,1.0,1.0,4.31, 台東区台東 1 丁目 32-6, 台東区, 台東区台東 1 丁目, 32-6
250000.0,Shared room,1,,1.0,5.0, 墨田区本所2丁目16-8, 墨田区, 墨田区本所2丁目,16-8
971400.0,Private room,2,1.0,1.0,4.5, 墨田区堤通1丁目−19−９ バーミヤンしらひげ橋店, 墨田区, 墨田区堤通1丁目,−19−９ バーミヤンしらひげ橋店
942900.0,Private room,2,,1.0,4.69, 墨田区堤通1丁目−14−７ 堤通公園平面広場, 墨田区, 墨田区堤通1丁目,−14−７ 堤通公園平面広場
1800000.0,Entire home apt,6,2.0,,4.95, 北区滝野川3丁目4-15, 北区, 北区滝野川3丁目,4-15
4357100.0,Entire home apt,10,3.0,10.0,4.92, 大田区羽田3丁目3-11, 大田区, 大田区羽田3丁目,3-11
765700.0,Private room,1,,,4.87, 台東区谷中2丁目3-2, 台東区, 台東区谷中2丁目,3-2
2004000.0,Entire home apt,8,2.0,7.0,4.83, 台東区蔵前3丁目19-10, 台東区, 台東区蔵前3丁目,19-10
1073900.0,Entire home apt,2,1.0,1.0,4.29, 新宿区新宿7丁目−27−12 コンフォリア東新宿ステーションフロント2F, 新宿区, 新宿区新宿7丁目,−27−12 コンフォリア東新宿ステーションフロント2F
1665100.0,Entire home apt,3,,1.0,4.0,新宿区歌舞伎町２丁目−５−１２ ガレリア東新宿,新宿区,新宿区歌舞伎町２丁目,−５−１２ ガレリア東新宿
1692200.0,Entire home apt,4,,2.0,4.31,新宿区歌舞伎町2丁目−4−11 ノア新宿１号館1104号室,新宿区,新宿区歌舞伎町2丁目,−4−11 ノア新宿１号館1104号室
1863500.0,Entire home apt,3,1.0,2.0,4.0, 新宿区新宿7丁目27番3号, 新宿区, 新宿区新宿7丁目,27番3号
2937100.0,Entire home apt,6,1.0,3.0,4.29, 新宿区新宿7丁目27-15, 新宿区, 新宿区新宿7丁目,27-15
2922900.0,Entire home apt,16,3.0,4.0,4.83, 葛飾区亀有3丁目2-10, 葛飾区, 葛飾区亀有3丁目,2-10
1670300.0,Entire home apt,6,2.0,5.0,4.91, 台東区蔵前3丁目19-10, 台東区, 台東区蔵前3丁目,19-10
1968000.0,Entire home apt,8,2.0,7.0,4.8, 台東区蔵前3丁目19-10, 台東区, 台東区蔵前3丁目,19-10
400000.0,Private room,1,,2.0,5.0, 大田区萩中3丁目28-13, 大田区, 大田区萩中3丁目,28-13
105238700.0,Entire home apt,2,1.0,2.0,4.93, 豊島区高田3丁目20番1号, 豊島区, 豊島区高田3丁目,20番1号
835700.0,Entire home apt,3,1.0,2.0,4.71,杉並区西荻北3丁目−25−14 サンハイツ荻,杉並区,杉並区西荻北3丁目,−25−14 サンハイツ荻
990000.0,Entire home apt,4,1.0,4.0,4.76, 杉並区西荻北3丁目4-12, 杉並区, 杉並区西荻北3丁目,4-12
6000000.0,Entire home apt,6,2.0,3.0,4.0, 渋谷区道玄坂2丁目16-16-8, 渋谷区, 渋谷区道玄坂2丁目,16-16-8
2720000.0,Entire home apt,10,3.0,4.0,4.64, 江戸川区平井5丁目−41−３ アーバンピア, 江戸川区, 江戸川区平井5丁目,−41−３ アーバンピア
2937100.0,Hotel room,6,2.0,,4.76, 新宿区内藤町11, 新宿区,, 新宿区内藤町11
2142900.0,Entire home apt,5,1.0,3.0,4.77, 台東区東上野2丁目−10−10 協和ビル, 台東区, 台東区東上野2丁目,−10−10 協和ビル
2100000.0,Entire home apt,5,1.0,2.0,4.8, 渋谷区神宮前3丁目−14−15 石崎ビル, 渋谷区, 渋谷区神宮前3丁目,−14−15 石崎ビル
3240000.0,Entire home apt,12,4.0,10.0,5.0, 新宿区西新宿5丁目22-5, 新宿区, 新宿区西新宿5丁目,22-5
3000000.0,Private room,2,1.0,2.0,, 荒川区東尾久4丁目1-14, 荒川区, 荒川区東尾久4丁目,1-14
2880000.0,Entire home apt,4,1.0,4.0,4.97, 渋谷区神宮前1丁目−6−15 ジュネスビル, 渋谷区, 渋谷区神宮前1丁目,−6−15 ジュネスビル
2207100.0,Entire home apt,4,1.0,2.0,4.8, 渋谷区円山町６−３−１０２, 渋谷区,, 渋谷区円山町６−３−１０２
2965700.0,Hotel room,6,2.0,1.0,4.75,新宿区内藤町１−２ フォルム内藤町,新宿区,,新宿区内藤町１−２ フォルム内藤町
1514300.0,Entire home apt,5,2.0,3.0,4.73, 杉並区高円寺南3丁目58-25, 杉並区, 杉並区高円寺南3丁目,58-25
1542900.0,Entire home apt,5,2.0,2.0,4.68, 杉並区高円寺北3丁目19-18, 杉並区, 杉並区高円寺北3丁目,19-18
1200000.0,Private room,3,,3.0,5.0, 武蔵野市吉祥寺本町1丁目33-11, 武蔵野市, 武蔵野市吉祥寺本町1丁目,33-11
2500000.0,Entire home apt,10,2.0,4.0,5.0,豊島区北大塚1丁目−1−１ 曙荘,豊島区,豊島区北大塚1丁目,−1−１ 曙荘
2928600.0,Entire home apt,6,1.0,3.0,4.73, 港区南麻布1丁目10 仙台坂, 港区, 港区南麻布1丁目,10 仙台坂
430000.0,Private room,3,,3.0,4.64, 台東区竜泉3丁目36-9, 台東区, 台東区竜泉3丁目,36-9
400000.0,Private room,2,,2.0,4.57, 台東区三ノ輪1丁目21-8, 台東区, 台東区三ノ輪1丁目,21-8
1185700.0,Entire home apt,4,1.0,1.0,4.26,豊島区上池袋4丁目−29−18 宍戸荘,豊島区,豊島区上池袋4丁目,−29−18 宍戸荘
1200000.0,Entire home apt,4,1.0,1.0,4.39, 豊島区上池袋3丁目16-17, 豊島区, 豊島区上池袋3丁目,16-17
1157100.0,Entire home apt,4,1.0,1.0,4.35, 豊島区上池袋3丁目7番5号, 豊島区, 豊島区上池袋3丁目,7番5号
1780000.0,Entire home apt,2,1.0,2.0,5.0, 豊島区南池袋1丁目−14−9 メゾンドハタ, 豊島区, 豊島区南池袋1丁目,−14−9 メゾンドハタ
1780000.0,Entire home apt,2,1.0,2.0,5.0, 豊島区南池袋1丁目14-2, 豊島区, 豊島区南池袋1丁目,14-2
1780000.0,Entire home apt,2,1.0,1.0,5.0, 豊島区南池袋1丁目−14−１ グリーンハウス, 豊島区, 豊島区南池袋1丁目,−14−１ グリーンハウス
1585700.0,Entire home apt,3,1.0,2.0,4.67,新宿区歌舞伎町２丁目−３１−７ 東京慶北ビル,新宿区,新宿区歌舞伎町２丁目,−３１−７ 東京慶北ビル
3428600.0,Entire home apt,4,1.0,2.0,4.68, 渋谷区本町6丁目20-9, 渋谷区, 渋谷区本町6丁目,20-9
4642900.0,Entire home apt,10,4.0,2.0,4.69, 台東区浅草4丁目7-10, 台東区, 台東区浅草4丁目,7-10
865700.0,Entire home apt,4,1.0,1.0,4.56, 墨田区八広2丁目27-2, 墨田区, 墨田区八広2丁目,27-2
450000.0,Entire home apt,3,1.0,1.0,4.71, 荒川区町屋4丁目34-13, 荒川区, 荒川区町屋4丁目,34-13
5000000.0,Hotel room,1,1.0,1.0,, 台東区東上野5丁目14-8, 台東区, 台東区東上野5丁目,14-8
2160000.0,Entire home apt,2,1.0,2.0,4.46, 墨田区向島3丁目43-3, 墨田区, 墨田区向島3丁目,43-3
3000000.0,Hotel room,3,1.0,4.0,5.0, 台東区上野3丁目−7−５ 天野ビル, 台東区, 台東区上野3丁目,−7−５ 天野ビル
700000.0,Entire home apt,4,1.0,4.0,4.86, 新宿区船町5, 新宿区,, 新宿区船町5
751400.0,Entire home apt,2,1.0,1.0,4.53, 中野区上高田3丁目40-8, 中野区, 中野区上高田3丁目,40-8
757100.0,Entire home apt,2,1.0,1.0,4.42, 中野区上高田3丁目40-8, 中野区, 中野区上高田3丁目,40-8
254300.0,Shared room,1,,2.0,4.73, 墨田区石原4丁目20-4, 墨田区, 墨田区石原4丁目,20-4
700000.0,Entire home apt,2,1.0,1.0,4.53, 中野区上高田3丁目40-8, 中野区, 中野区上高田3丁目,40-8
380000.0,Private room,3,,3.0,4.91, 台東区三ノ輪1丁目4-2, 台東区, 台東区三ノ輪1丁目,4-2
2081800.0,Entire home apt,2,1.0,1.0,4.34, 渋谷区道玄坂2丁目20-26 エクスシール道玄坂, 渋谷区, 渋谷区道玄坂2丁目,20-26 エクスシール道玄坂
1542900.0,Entire home apt,3,1.0,2.0,4.85, 渋谷区代々木3丁目9-5, 渋谷区, 渋谷区代々木3丁目,9-5
4585700.0,Entire home apt,16,2.0,10.0,4.96, 江東区大島7丁目26-3, 江東区, 江東区大島7丁目,26-3
3757100.0,Entire home apt,12,5.0,7.0,4.88, 墨田区墨田2丁目24番2号, 墨田区, 墨田区墨田2丁目,24番2号
5000000.0,Hotel room,1,1.0,1.0,5.0,台東区東上野4丁目−11−１ 東京地下鉄上野通信区,台東区,台東区東上野4丁目,−11−１ 東京地下鉄上野通信区
5000000.0,Hotel room,1,1.0,1.0,4.83, 台東区上野7丁目9-16, 台東区, 台東区上野7丁目,9-16
5000000.0,Hotel room,1,1.0,1.0,, 台東区上野7丁目9-18, 台東区, 台東区上野7丁目,9-18
5000000.0,Hotel room,1,1.0,1.0,, 台東区東上野5丁目−14−７ 上野アムフラット２ 1階, 台東区, 台東区東上野5丁目,−14−７ 上野アムフラット２ 1階
5000000.0,Hotel room,1,1.0,1.0,, 台東区東上野 4 丁目 24-12, 台東区, 台東区東上野 4 丁目, 24-12
5000000.0,Hotel room,1,1.0,1.0,4.89, 台東区東上野5丁目12-1, 台東区, 台東区東上野5丁目,12-1
5000000.0,Hotel room,1,1.0,1.0,5.0,台東区東上野4丁目−16−３ 日本舞踏教室 坂東福久鼓,台東区,台東区東上野4丁目,−16−３ 日本舞踏教室 坂東福久鼓
5000000.0,Hotel room,1,1.0,1.0,5.0, 台東区東上野5丁目20-2, 台東区, 台東区東上野5丁目,20-2
5000000.0,Hotel room,1,1.0,1.0,4.0, 台東区東上野5丁目−14−７ 上野アムフラット２, 台東区, 台東区東上野5丁目,−14−７ 上野アムフラット２
5000000.0,Hotel room,1,1.0,1.0,4.85, 台東区東上野5丁目−23−６ ヒライビル, 台東区, 台東区東上野5丁目,−23−６ ヒライビル
5000000.0,Hotel room,1,1.0,1.0,, 台東区東上野5丁目−13−４ 美玉ビル, 台東区, 台東区東上野5丁目,−13−４ 美玉ビル
5000000.0,Hotel room,1,1.0,1.0,4.4, 台東区東上野 4 丁目 7-11, 台東区, 台東区東上野 4 丁目, 7-11
5000000.0,Hotel room,1,1.0,1.0,, 台東区東上野 4 丁目 26-8, 台東区, 台東区東上野 4 丁目, 26-8
5000000.0,Hotel room,1,1.0,1.0,, 台東区東上野4丁目27, 台東区, 台東区東上野4丁目,27
5000000.0,Hotel room,1,1.0,1.0,, 台東区東上野 4 丁目 25-18, 台東区, 台東区東上野 4 丁目, 25-18
5000000.0,Hotel room,1,1.0,1.0,4.5, 台東区東上野4丁目−10−14 第二東ビル, 台東区, 台東区東上野4丁目,−10−14 第二東ビル
5000000.0,Hotel room,1,1.0,1.0,5.0, 台東区東上野5丁目13-6, 台東区, 台東区東上野5丁目,13-6
5000000.0,Hotel room,1,1.0,1.0,4.6,台東区東上野4丁目−11−１ 東京地下鉄上野通信区,台東区,台東区東上野4丁目,−11−１ 東京地下鉄上野通信区
5000000.0,Hotel room,1,1.0,1.0,5.0, 台東区東上野5丁目20-2, 台東区, 台東区東上野5丁目,20-2
5000000.0,Hotel room,1,1.0,1.0,5.0, 台東区東上野 4 丁目 26-9, 台東区, 台東区東上野 4 丁目, 26-9
5000000.0,Hotel room,1,1.0,1.0,3.0, 台東区東上野4丁目10-14-402, 台東区, 台東区東上野4丁目,10-14-402
5000000.0,Hotel room,1,1.0,1.0,, 台東区東上野4丁目10-14-402, 台東区, 台東区東上野4丁目,10-14-402
5000000.0,Hotel room,1,1.0,1.0,, 台東区東上野 4 丁目 23-4, 台東区, 台東区東上野 4 丁目, 23-4
5000000.0,Hotel room,1,1.0,1.0,, 台東区東上野 4 丁目 24-12, 台東区, 台東区東上野 4 丁目, 24-12
5000000.0,Hotel room,1,1.0,1.0,4.5, 台東区東上野5丁目13-9, 台東区, 台東区東上野5丁目,13-9
5000000.0,Hotel room,1,1.0,1.0,, 台東区東上野5丁目−14−７ 上野アムフラット２, 台東区, 台東区東上野5丁目,−14−７ 上野アムフラット２
5000000.0,Hotel room,1,1.0,1.0,4.47, 台東区東上野 4 丁目 12-2, 台東区, 台東区東上野 4 丁目, 12-2
5000000.0,Hotel room,1,1.0,1.0,4.5, 台東区上野7丁目9-16, 台東区, 台東区上野7丁目,9-16
5000000.0,Hotel room,1,1.0,1.0,, 台東区上野7丁目9-16, 台東区, 台東区上野7丁目,9-16
5000000.0,Hotel room,1,1.0,1.0,, 台東区東上野 4 丁目 7-13, 台東区, 台東区東上野 4 丁目, 7-13
5000000.0,Hotel room,1,1.0,1.0,, 台東区上野7丁目9-17, 台東区, 台東区上野7丁目,9-17
5000000.0,Hotel room,1,1.0,1.0,5.0, 台東区東上野5丁目13-6, 台東区, 台東区東上野5丁目,13-6
5000000.0,Hotel room,1,1.0,1.0,, 台東区東上野 4 丁目 25-21, 台東区, 台東区東上野 4 丁目, 25-21
5000000.0,Hotel room,1,1.0,1.0,, 台東区東上野 4 丁目 25-21, 台東区, 台東区東上野 4 丁目, 25-21
5000000.0,Hotel room,1,1.0,1.0,5.0, 台東区東上野5丁目14-8, 台東区, 台東区東上野5丁目,14-8
5000000.0,Hotel room,1,1.0,1.0,4.76, 台東区東上野 4 丁目 25-29, 台東区, 台東区東上野 4 丁目, 25-29
5000000.0,Hotel room,1,1.0,1.0,, 台東区東上野5丁目13-8, 台東区, 台東区東上野5丁目,13-8
5000000.0,Hotel room,1,1.0,1.0,, 台東区東上野5丁目14-8, 台東区, 台東区東上野5丁目,14-8
5000000.0,Hotel room,1,1.0,1.0,4.0, 台東区東上野5丁目15-5, 台東区, 台東区東上野5丁目,15-5
5000000.0,Hotel room,1,1.0,1.0,4.75, 台東区東上野 4 丁目 24-11, 台東区, 台東区東上野 4 丁目, 24-11
5000000.0,Hotel room,1,1.0,1.0,, 台東区上野7丁目9-16, 台東区, 台東区上野7丁目,9-16
5000000.0,Hotel room,1,1.0,1.0,, 台東区東上野5丁目12-5, 台東区, 台東区東上野5丁目,12-5
5000000.0,Hotel room,1,1.0,1.0,, 台東区東上野5丁目13-6, 台東区, 台東区東上野5丁目,13-6
5000000.0,Hotel room,1,1.0,1.0,, 台東区東上野 4 丁目 12-2, 台東区, 台東区東上野 4 丁目, 12-2
5000000.0,Hotel room,1,1.0,1.0,5.0, 台東区東上野 4 丁目 26-9, 台東区, 台東区東上野 4 丁目, 26-9
5000000.0,Hotel room,1,1.0,1.0,4.63,台東区東上野５丁目−７−８ 大政ビル,台東区,台東区東上野５丁目,−７−８ 大政ビル
5000000.0,Hotel room,1,1.0,1.0,, 台東区東上野4丁目16-2 202, 台東区, 台東区東上野4丁目,16-2 202
5000000.0,Hotel room,1,1.0,1.0,4.67, 台東区上野7丁目9-13, 台東区, 台東区上野7丁目,9-13
5000000.0,Hotel room,1,1.0,1.0,, 台東区東上野 4 丁目 24-12, 台東区, 台東区東上野 4 丁目, 24-12
5000000.0,Hotel room,1,1.0,1.0,, 台東区上野7丁目12-12-14, 台東区, 台東区上野7丁目,12-12-14
15000000.0,Entire home apt,7,3.0,4.0,5.0, 台東区寿2丁目7-6, 台東区, 台東区寿2丁目,7-6
3500000.0,Entire home apt,6,3.0,4.0,5.0, 新宿区大久保3丁目5番地, 新宿区, 新宿区大久保3丁目,5番地
425700.0,Private room,2,,1.0,4.86, 中央区日本橋大伝馬町1-3, 中央区,, 中央区日本橋大伝馬町1-3
641100.0,Private room,2,,1.0,4.89, 世田谷区瀬田5丁目34-1, 世田谷区, 世田谷区瀬田5丁目,34-1
2000000.0,Private room,5,,6.0,4.67, 杉並区高円寺北4丁目29-6, 杉並区, 杉並区高円寺北4丁目,29-6
500000.0,Private room,2,,1.0,4.73, 中央区日本橋本町3丁目-6, 中央区, 中央区日本橋本町3丁目,-6
650000.0,Private room,3,,2.0,4.61, 中央区日本橋小舟町11−１ 松久庵, 中央区,, 中央区日本橋小舟町11−１ 松久庵
488800.0,Private room,2,,2.0,4.75, 中央区日本橋本町2丁目5番地, 中央区, 中央区日本橋本町2丁目,5番地
1249500.0,Entire home apt,3,1.0,2.0,4.79, 中央区日本橋本町2丁目5番地, 中央区, 中央区日本橋本町2丁目,5番地
2471400.0,Entire home apt,6,1.0,3.0,4.51, 豊島区南大塚3丁目52-10, 豊島区, 豊島区南大塚3丁目,52-10
5000000.0,Hotel room,1,1.0,1.0,4.81, 台東区東上野5丁目12-9, 台東区, 台東区東上野5丁目,12-9
5000000.0,Hotel room,1,1.0,1.0,4.0, 台東区東上野 4 丁目 24-11, 台東区, 台東区東上野 4 丁目, 24-11
5000000.0,Hotel room,1,1.0,1.0,, 台東区東上野5丁目12-3, 台東区, 台東区東上野5丁目,12-3
5000000.0,Hotel room,1,1.0,1.0,4.0,台東区東上野４丁目−２６、昭和通り３丁目,台東区,台東区東上野４丁目,−２６、昭和通り３丁目
5000000.0,Hotel room,1,1.0,1.0,4.83, 台東区東上野 4 丁目 23-1, 台東区, 台東区東上野 4 丁目, 23-1
5000000.0,Hotel room,1,1.0,1.0,5.0, 台東区上野7丁目−9−15 車坂ビル５０２号, 台東区, 台東区上野7丁目,−9−15 車坂ビル５０２号
5000000.0,Hotel room,1,1.0,1.0,4.78, 台東区東上野5丁目−7−７ 上原ビル3階, 台東区, 台東区東上野5丁目,−7−７ 上原ビル3階
5000000.0,Hotel room,1,1.0,1.0,, 台東区上野7丁目−9−15 牧野ビル, 台東区, 台東区上野7丁目,−9−15 牧野ビル
5000000.0,Hotel room,1,1.0,1.0,, 台東区東上野 4 丁目 24-12, 台東区, 台東区東上野 4 丁目, 24-12
9020800.0,Entire home apt,9,2.0,4.0,4.52, 渋谷区円山町25-2, 渋谷区,, 渋谷区円山町25-2
2800000.0,Entire home apt,7,3.0,6.0,4.51, 江戸川区南葛西1丁目13-15, 江戸川区, 江戸川区南葛西1丁目,13-15
2171400.0,Entire home apt,4,1.0,2.0,4.47, 渋谷区本町3丁目−44−２ Ｓカーサ, 渋谷区, 渋谷区本町3丁目,−44−２ Ｓカーサ
5000000.0,Hotel room,1,1.0,1.0,, 台東区東上野4丁目7-12, 台東区, 台東区東上野4丁目,7-12
5000000.0,Hotel room,1,1.0,1.0,, 台東区東上野5丁目12-7, 台東区, 台東区東上野5丁目,12-7
5000000.0,Hotel room,1,1.0,1.0,4.0, 台東区東上野 4 丁目 24-12, 台東区, 台東区東上野 4 丁目, 24-12
5000000.0,Hotel room,1,1.0,1.0,4.7, 台東区東上野 4 丁目 26-3, 台東区, 台東区東上野 4 丁目, 26-3
5000000.0,Hotel room,1,1.0,1.0,, 台東区上野7丁目−9−15 牧野ビル, 台東区, 台東区上野7丁目,−9−15 牧野ビル
5000000.0,Hotel room,1,1.0,1.0,, 台東区上野7丁目9-16, 台東区, 台東区上野7丁目,9-16
5000000.0,Hotel room,1,1.0,1.0,, 台東区東上野5丁目15-1, 台東区, 台東区東上野5丁目,15-1
5000000.0,Hotel room,1,1.0,1.0,4.5,台東区上野7丁目−9−１４ スーパーホテルＪＲ上野入谷口,台東区,台東区上野7丁目,−9−１４ スーパーホテルＪＲ上野入谷口
5000000.0,Hotel room,1,1.0,1.0,, 台東区東上野 4 丁目 11-3, 台東区, 台東区東上野 4 丁目, 11-3
5000000.0,Hotel room,1,1.0,1.0,5.0, 台東区東上野 4 丁目 24-12, 台東区, 台東区東上野 4 丁目, 24-12
5000000.0,Hotel room,1,1.0,1.0,4.0, 台東区東上野5丁目11-3, 台東区, 台東区東上野5丁目,11-3
5000000.0,Hotel room,1,1.0,1.0,, 台東区東上野 4 丁目 23-5, 台東区, 台東区東上野 4 丁目, 23-5
5000000.0,Hotel room,1,1.0,1.0,5.0, 台東区東上野5丁目14-1, 台東区, 台東区東上野5丁目,14-1
5000000.0,Hotel room,1,1.0,1.0,, 台東区東上野5丁目12-3, 台東区, 台東区東上野5丁目,12-3
